url,depth,title,meta_description,meta_keywords,internal_link_count,external_link_count,word_count,h1_tags,h2_tags,main_word_count,image_count,link_texts
https://4anime.gg/fog-hill-of-five-elements-2nd-season-18453,2,Watch Fog Hill of Five Elements 2nd Season online free on 4anime,Watch Fog Hill of Five Elements 2nd Season in HD quality and download Fog Hill of Five Elements 2nd Season HD version for free - DUB and SUB available,"watch Fog Hill of Five Elements 2nd Season online free, Fog Hill of Five Elements 2nd Season download, free Fog Hill of Five Elements 2nd Season stream, Fog Hill of Five Elements 2nd Season DUB, Fog Hill of Five Elements 2nd Season SUB",25,0,110,"['Fog Hill of Five Elements 2nd Season', 'Fog Hill of Five Elements 2nd Season']",['Samsara Studio'],0,3,"['Login', 'Register', 'Browser', 'Genre', 'Random', 'FAQ', 'Option', '', 'Browse', 'Random', 'Genre', '', 'Action', 'Fantasy', 'Historical', 'Martial Arts', 'Supernatural', 'Samsara Studio', 'ONA', 'Samsara Studio', 'Action', 'Fantasy', 'Historical', 'Martial Arts', 'Supernatural']"
https://4anime.gg/studio/samsara-studio,3,Watch Samsara Studio anime online for Free on 9anime,Here on 9anime you can find all the latest and famous anime from Samsara Studio in HD Quality 1080. Watch and Download now,"Samsara Studio anime, Samsara Studio info, Samsara Studio download, Samsara Studio watch, 9anime, free anime online, watch anime",15,0,65,[],['Samsara Studio Studio Anime'],0,3,"['Login', 'Register', 'Browser', 'Genre', 'Random', 'FAQ', 'Option', '', 'Browse', 'Random', 'Genre', '', '', 'Fog Hill of Five Elements 2nd Season', 'Episode 4']"
https://4anime.gg/slay-the-gods-19401,2,Watch Slay The Gods online free on 4anime,Watch Slay The Gods in HD quality and download Slay The Gods HD version for free - DUB and SUB available,"watch Slay The Gods online free, Slay The Gods download, free Slay The Gods stream, Slay The Gods DUB, Slay The Gods SUB",21,0,180,"['Slay The Gods', 'Slay The Gods']",['Shenman Entertainment'],0,3,"['Login', 'Register', 'Browser', 'Genre', 'Random', 'FAQ', 'Option', '', 'Browse', 'Random', 'Genre', '', 'Action', 'Fantasy', 'Thriller', 'Shenman Entertainment', 'ONA', 'Shenman Entertainment', 'Action', 'Fantasy', 'Thriller']"
https://4anime.gg/studio/shenman-entertainment,3,Watch Shenman Entertainment anime online for Free on 9anime,Here on 9anime you can find all the latest and famous anime from Shenman Entertainment in HD Quality 1080. Watch and Download now,"Shenman Entertainment anime, Shenman Entertainment info, Shenman Entertainment download, Shenman Entertainment watch, 9anime, free anime online, watch anime",24,0,78,[],['Shenman Entertainment Studio Anime'],0,6,"['Login', 'Register', 'Browser', 'Genre', 'Random', 'FAQ', 'Option', '', 'Browse', 'Random', 'Genre', '', '', 'Throne of Seal', 'Episode 26', '', 'The Demon Hunter', 'Episode 26', '', 'Throne of Seal 2nd Season', 'Episode 71', '', 'Slay The Gods', 'Episode 15']"
https://4anime.gg/her-blue-sky-1418,2,Watch Her Blue Sky online free on 4anime,Watch Her Blue Sky in HD quality and download Her Blue Sky HD version for free - DUB and SUB available,"watch Her Blue Sky online free, Her Blue Sky download, free Her Blue Sky stream, Her Blue Sky DUB, Her Blue Sky SUB",17,0,267,"['Her Blue Sky', 'Her Blue Sky']",['CloverWorks'],0,3,"['Login', 'Register', 'Browser', 'Genre', 'Random', 'FAQ', 'Option', '', 'Browse', 'Random', 'Genre', '', 'Drama', 'CloverWorks', 'Movie', 'CloverWorks', 'Drama']"
https://4anime.gg/recently-added?page=2,2,4anime - Watch Anime online free with English DUB and SUB,Free anime website with real 1080 HD quality with English subtitle - Just sit back and relax!,"4anime, 4 anime, 4animeto, watch anime online, free anime, anime free, online anime, anime website",139,0,357,[],['Recently Added'],0,42,"['Login', 'Register', 'Browser', 'Genre', 'Random', 'FAQ', 'Option', '', 'Browse', 'Random', 'Genre', '', '', 'Shy Season 2', 'Episode 12', '', 'Spice and Wolf: Merchant Meets the Wise Wolf', 'Episode 25', '', 'Haai Step Jun', 'Episode 23', '', 'Yami Shibai 13', 'Episode 13', '', 'Plus-Sized Elf', 'Episode 13', '', 'VTuber Legend: How I Went Viral after Forgetting to Turn Off My Stream', 'Episode 12', '', 'Inu-Ou', 'Episode 1', '', 'Atri -My Dear Moments-', 'Episode 13', '', ""Atashin'chi Next"", 'Episode 5', '', 'Hidden Sect Leader', 'Episode 52', '', 'My Instant Death Ability is So Overpowered, No One in This Other World Stands a Chance Against Me!', 'Episode 12', '', 'Dead Dead Demons Dededede Destruction', 'Episode 17', '', 'Twilight Out of Focus', 'Episode 12', '', 'Alya Sometimes Hides Her Feelings in Russian', 'Episode 12', '', 'Hey! Tonbo', 'Episode 13', '', 'Shadowverse Flame: Arc-hen', 'Episode 23', '', 'Egumi Legacy', 'Episode 12', '', 'Bye Bye, Earth', 'Episode 10', '', 'Yatagarasu: The Raven Does Not Choose Its Master', 'Episode 20', '', 'Shoshimin: How to Become Ordinary', 'Episode 10', '', 'The Fable', 'Episode 25', '', 'Grendizer U', 'Episode 13', '', 'Quality Assurance in Another World', 'Episode 13', '', 'Sakuna: Of Rice and Ruin', 'Episode 13', '', ""A Nobody's Way Up to an Exploration Hero LV"", 'Episode 12', '', 'Suna no Bara: Yuki no Mokushiroku', 'Episode 1', '', 'Jinwu Guard: The Wind Rises in Jinling', 'Episode 16', '', 'Dungeon People', 'Episode 12', '', 'Failure Frame: I Became the Strongest and Annihilated Everything With Low-Level Spells', 'Episode 12', '', 'Senpai is an Otokonoko', 'Episode 12', '', 'Brick of Heaven', 'Episode 18', '', 'The Immortal Legend', 'Episode 12', '', 'Love Is Indivisible by Twins', 'Episode 12', '', 'Sengoku Youko - Recap', 'Episode 2', '', 'The Magical Girl and the Evil Lieutenant Used to Be Archenemies', 'Episode 12', '', ""Mom, I'm Sorry"", 'Episode 18', '', 'The Ossan Newbie Adventurer, Trained to Death by the Most Powerful Party, Became Invincible', 'Episode 12', '', 'My Deer Friend Nokotan', 'Episode 12', '', ""The Strongest Magician in the Demon Lord's Army Was a Human"", 'Episode 12', '', 'Midnight Punch', 'Episode 12', '«', '‹', '1', '3', '4', '›', '»']"
https://4anime.gg/shy-season-2-19222,3,Watch Shy Season 2 online free on 4anime,Watch Shy Season 2 in HD quality and download Shy Season 2 HD version for free - DUB and SUB available,"watch Shy Season 2 online free, Shy Season 2 download, free Shy Season 2 stream, Shy Season 2 DUB, Shy Season 2 SUB",23,0,230,"['Shy Season 2', 'Shy Season 2']",['8bit'],0,3,"['Login', 'Register', 'Browser', 'Genre', 'Random', 'FAQ', 'Option', '', 'Browse', 'Random', 'Genre', '', 'Action', 'Drama', 'Shounen', 'Super Power', '8bit', 'TV Series', '8bit', 'Action', 'Drama', 'Shounen', 'Super Power']"
https://4anime.gg/spice-and-wolf-merchant-meets-the-wise-wolf-19143,3,Watch Spice and Wolf: Merchant Meets the Wise Wolf online free on 4anime,Watch Spice and Wolf: Merchant Meets the Wise Wolf in HD quality and download Spice and Wolf: Merchant Meets the Wise Wolf HD version for free - DUB and SUB available,"watch Spice and Wolf: Merchant Meets the Wise Wolf online free, Spice and Wolf: Merchant Meets the Wise Wolf download, free Spice and Wolf: Merchant Meets the Wise Wolf stream, Spice and Wolf: Merchant Meets the Wise Wolf DUB, Spice and Wolf: Merchant Meets the Wise Wolf SUB",23,0,295,"['Spice and Wolf: Merchant Meets the Wise Wolf', 'Spice and Wolf: Merchant Meets the Wise Wolf']",['Passione'],0,3,"['Login', 'Register', 'Browser', 'Genre', 'Random', 'FAQ', 'Option', '', 'Browse', 'Random', 'Genre', '', 'Adventure', 'Drama', 'Fantasy', 'Romance', 'Passione', 'TV Series', 'Passione', 'Adventure', 'Drama', 'Fantasy', 'Romance']"
https://4anime.gg/haai-step-jun-6454,3,Watch Haai Step Jun online free on 4anime,Watch Haai Step Jun in HD quality and download Haai Step Jun HD version for free - DUB and SUB available,"watch Haai Step Jun online free, Haai Step Jun download, free Haai Step Jun stream, Haai Step Jun DUB, Haai Step Jun SUB",23,0,261,"['Haai Step Jun', 'Haai Step Jun']",['Toei Animation'],0,3,"['Login', 'Register', 'Browser', 'Genre', 'Random', 'FAQ', 'Option', '', 'Browse', 'Random', 'Genre', '', 'Action', 'Romance', 'School', 'Sci-Fi', 'Toei Animation', 'TV Series', 'Toei Animation', 'Action', 'Romance', 'School', 'Sci-Fi']"
https://4anime.gg/yami-shibai-13-19205,3,Watch Yami Shibai 13 online free on 4anime,Watch Yami Shibai 13 in HD quality and download Yami Shibai 13 HD version for free - DUB and SUB available,"watch Yami Shibai 13 online free, Yami Shibai 13 download, free Yami Shibai 13 stream, Yami Shibai 13 DUB, Yami Shibai 13 SUB",21,0,91,"['Yami Shibai 13', 'Yami Shibai 13']",['ILCA'],0,3,"['Login', 'Register', 'Browser', 'Genre', 'Random', 'FAQ', 'Option', '', 'Browse', 'Random', 'Genre', '', 'Dementia', 'Horror', 'Supernatural', 'ILCA', 'TV Series', 'ILCA', 'Dementia', 'Horror', 'Supernatural']"
https://4anime.gg/plus-sized-elf-19224,3,Watch Plus-Sized Elf online free on 4anime,Watch Plus-Sized Elf in HD quality and download Plus-Sized Elf HD version for free - DUB and SUB available,"watch Plus-Sized Elf online free, Plus-Sized Elf download, free Plus-Sized Elf stream, Plus-Sized Elf DUB, Plus-Sized Elf SUB",23,0,171,"['Plus-Sized Elf', 'Plus-Sized Elf']",['Elias'],0,3,"['Login', 'Register', 'Browser', 'Genre', 'Random', 'FAQ', 'Option', '', 'Browse', 'Random', 'Genre', '', 'Comedy', 'Ecchi', 'Fantasy', 'Slice of Life', 'Elias', 'TV Series', 'Elias', 'Comedy', 'Ecchi', 'Fantasy', 'Slice of Life']"
https://4anime.gg/vtuber-legend-how-i-went-viral-after-forgetting-to-turn-off-my-stream-19225,3,Watch VTuber Legend: How I Went Viral after Forgetting to Turn Off My Stream online free on 4anime,Watch VTuber Legend: How I Went Viral after Forgetting to Turn Off My Stream in HD quality and download VTuber Legend: How I Went Viral after Forgetting to Turn Off My Stream HD version for free - DUB and SUB available,"watch VTuber Legend: How I Went Viral after Forgetting to Turn Off My Stream online free, VTuber Legend: How I Went Viral after Forgetting to Turn Off My Stream download, free VTuber Legend: How I Went Viral after Forgetting to Turn Off My Stream stream, VTuber Legend: How I Went Viral after Forgetting to Turn Off My Stream DUB, VTuber Legend: How I Went Viral after Forgetting to Turn Off My Stream SUB",19,0,289,"['VTuber Legend: How I Went Viral after Forgetting to Turn Off My Stream', 'VTuber Legend: How I Went Viral after Forgetting to Turn Off My Stream']",['TNK'],0,3,"['Login', 'Register', 'Browser', 'Genre', 'Random', 'FAQ', 'Option', '', 'Browse', 'Random', 'Genre', '', 'Comedy', 'Slice of Life', 'TNK', 'TV Series', 'TNK', 'Comedy', 'Slice of Life']"
https://4anime.gg/inu-ou-15742,3,Watch Inu-Ou online free on 4anime,Watch Inu-Ou in HD quality and download Inu-Ou HD version for free - DUB and SUB available,"watch Inu-Ou online free, Inu-Ou download, free Inu-Ou stream, Inu-Ou DUB, Inu-Ou SUB",21,0,224,"['Inu-Ou', 'Inu-Ou']",['Science SARU'],0,3,"['Login', 'Register', 'Browser', 'Genre', 'Random', 'FAQ', 'Option', '', 'Browse', 'Random', 'Genre', '', 'Fantasy', 'Historical', 'Music', 'Science SARU', 'Movie', 'Science SARU', 'Fantasy', 'Historical', 'Music']"
https://4anime.gg/atri-my-dear-moments-19243,3,Watch Atri -My Dear Moments- online free on 4anime,Watch Atri -My Dear Moments- in HD quality and download Atri -My Dear Moments- HD version for free - DUB and SUB available,"watch Atri -My Dear Moments- online free, Atri -My Dear Moments- download, free Atri -My Dear Moments- stream, Atri -My Dear Moments- DUB, Atri -My Dear Moments- SUB",21,0,321,"['Atri -My Dear Moments-', 'Atri -My Dear Moments-']",['TROYCA'],0,3,"['Login', 'Register', 'Browser', 'Genre', 'Random', 'FAQ', 'Option', '', 'Browse', 'Random', 'Genre', '', 'Drama', 'Romance', 'Sci-Fi', 'TROYCA', 'TV Series', 'TROYCA', 'Drama', 'Romance', 'Sci-Fi']"
https://4anime.gg/atashinchi-next-19179,3,Watch Atashin'chi Next online free on 4anime,Watch Atashin'chi Next in HD quality and download Atashin'chi Next HD version for free - DUB and SUB available,"watch Atashin'chi Next online free, Atashin'chi Next download, free Atashin'chi Next stream, Atashin'chi Next DUB, Atashin'chi Next SUB",15,0,77,"[""Atashin'chi Next"", ""Atashin'chi Next""]",[''],0,3,"['Login', 'Register', 'Browser', 'Genre', 'Random', 'FAQ', 'Option', '', 'Browse', 'Random', 'Genre', '', 'Comedy', 'ONA', 'Comedy']"
https://4anime.gg/hidden-sect-leader-19397,3,Watch Hidden Sect Leader online free on 4anime,Watch Hidden Sect Leader in HD quality and download Hidden Sect Leader HD version for free - DUB and SUB available,"watch Hidden Sect Leader online free, Hidden Sect Leader download, free Hidden Sect Leader stream, Hidden Sect Leader DUB, Hidden Sect Leader SUB",19,0,162,"['Hidden Sect Leader', 'Hidden Sect Leader']",[''],0,3,"['Login', 'Register', 'Browser', 'Genre', 'Random', 'FAQ', 'Option', '', 'Browse', 'Random', 'Genre', '', 'Action', 'Adventure', 'Fantasy', 'ONA', 'Action', 'Adventure', 'Fantasy']"
https://4anime.gg/my-instant-death-ability-is-so-overpowered-no-one-in-this-other-world-stands-a-chance-against-me-18847,3,"Watch My Instant Death Ability is So Overpowered, No One in This Other World Stands a Chance Against Me! online free on 4anime","Watch My Instant Death Ability is So Overpowered, No One in This Other World Stands a Chance Against Me! in HD quality and download My Instant Death Ability is So Overpowered, No One in This Other World Stands a Chance Against Me! HD version for free - DUB and SUB available","watch My Instant Death Ability is So Overpowered, No One in This Other World Stands a Chance Against Me! online free, My Instant Death Ability is So Overpowered, No One in This Other World Stands a Chance Against Me! download, free My Instant Death Ability is So Overpowered, No One in This Other World Stands a Chance Against Me! stream, My Instant Death Ability is So Overpowered, No One in This Other World Stands a Chance Against Me! DUB, My Instant Death Ability is So Overpowered, No One in This Other World Stands a Chance Against Me! SUB",25,0,269,"['My Instant Death Ability is So Overpowered, No One in This Other World Stands a Chance Against Me!', 'My Instant Death Ability is So Overpowered, No One in This Other World Stands a Chance Against Me!']",['Okuruto Noboru'],0,3,"['Login', 'Register', 'Browser', 'Genre', 'Random', 'FAQ', 'Option', '', 'Browse', 'Random', 'Genre', '', 'Action', 'Adventure', 'Comedy', 'Fantasy', 'Isekai', 'Okuruto Noboru', 'TV Series', 'Okuruto Noboru', 'Action', 'Adventure', 'Comedy', 'Fantasy', 'Isekai']"
https://4anime.gg/dead-dead-demons-dededede-destruction-19171,3,Watch Dead Dead Demons Dededede Destruction online free on 4anime,Watch Dead Dead Demons Dededede Destruction in HD quality and download Dead Dead Demons Dededede Destruction HD version for free - DUB and SUB available,"watch Dead Dead Demons Dededede Destruction online free, Dead Dead Demons Dededede Destruction download, free Dead Dead Demons Dededede Destruction stream, Dead Dead Demons Dededede Destruction DUB, Dead Dead Demons Dededede Destruction SUB",23,0,259,"['Dead Dead Demons Dededede Destruction', 'Dead Dead Demons Dededede Destruction']",['Production +h.'],0,3,"['Login', 'Register', 'Browser', 'Genre', 'Random', 'FAQ', 'Option', '', 'Browse', 'Random', 'Genre', '', 'Drama', 'School', 'Sci-Fi', 'Seinen', 'Production +h.', 'ONA', 'Production +h.', 'Drama', 'School', 'Sci-Fi', 'Seinen']"
https://4anime.gg/twilight-out-of-focus-19230,3,Watch Twilight Out of Focus online free on 4anime,Watch Twilight Out of Focus in HD quality and download Twilight Out of Focus HD version for free - DUB and SUB available,"watch Twilight Out of Focus online free, Twilight Out of Focus download, free Twilight Out of Focus stream, Twilight Out of Focus DUB, Twilight Out of Focus SUB",21,0,269,"['Twilight Out of Focus', 'Twilight Out of Focus']",['Studio Deen'],0,3,"['Login', 'Register', 'Browser', 'Genre', 'Random', 'FAQ', 'Option', '', 'Browse', 'Random', 'Genre', '', 'Drama', 'Romance', 'School', 'Studio Deen', 'TV Series', 'Studio Deen', 'Drama', 'Romance', 'School']"
https://4anime.gg/alya-sometimes-hides-her-feelings-in-russian-19254,3,Watch Alya Sometimes Hides Her Feelings in Russian online free on 4anime,Watch Alya Sometimes Hides Her Feelings in Russian in HD quality and download Alya Sometimes Hides Her Feelings in Russian HD version for free - DUB and SUB available,"watch Alya Sometimes Hides Her Feelings in Russian online free, Alya Sometimes Hides Her Feelings in Russian download, free Alya Sometimes Hides Her Feelings in Russian stream, Alya Sometimes Hides Her Feelings in Russian DUB, Alya Sometimes Hides Her Feelings in Russian SUB",23,0,270,"['Alya Sometimes Hides Her Feelings in Russian', 'Alya Sometimes Hides Her Feelings in Russian']",['Doga Kobo'],0,3,"['Login', 'Register', 'Browser', 'Genre', 'Random', 'FAQ', 'Option', '', 'Browse', 'Random', 'Genre', '', 'Comedy', 'Romance', 'School', 'Slice of Life', 'Doga Kobo', 'TV Series', 'Doga Kobo', 'Comedy', 'Romance', 'School', 'Slice of Life']"
https://4anime.gg/hey-tonbo-19098,3,Watch Hey! Tonbo online free on 4anime,Watch Hey! Tonbo in HD quality and download Hey! Tonbo HD version for free - DUB and SUB available,"watch Hey! Tonbo online free, Hey! Tonbo download, free Hey! Tonbo stream, Hey! Tonbo DUB, Hey! Tonbo SUB",19,0,212,"['Hey! Tonbo', 'Hey! Tonbo']",['OLM'],0,3,"['Login', 'Register', 'Browser', 'Genre', 'Random', 'FAQ', 'Option', '', 'Browse', 'Random', 'Genre', '', 'Drama', 'Sports', 'OLM', 'TV Series', 'OLM', 'Drama', 'Sports']"
https://4anime.gg/shadowverse-flame-arc-hen-19095,3,Watch Shadowverse Flame: Arc-hen online free on 4anime,Watch Shadowverse Flame: Arc-hen in HD quality and download Shadowverse Flame: Arc-hen HD version for free - DUB and SUB available,"watch Shadowverse Flame: Arc-hen online free, Shadowverse Flame: Arc-hen download, free Shadowverse Flame: Arc-hen stream, Shadowverse Flame: Arc-hen DUB, Shadowverse Flame: Arc-hen SUB",19,0,167,"['Shadowverse Flame: Arc-hen', 'Shadowverse Flame: Arc-hen']",['Zexcs'],0,3,"['Login', 'Register', 'Browser', 'Genre', 'Random', 'FAQ', 'Option', '', 'Browse', 'Random', 'Genre', '', 'Fantasy', 'Game', 'Zexcs', 'TV Series', 'Zexcs', 'Fantasy', 'Game']"
https://4anime.gg/egumi-legacy-19204,3,Watch Egumi Legacy online free on 4anime,Watch Egumi Legacy in HD quality and download Egumi Legacy HD version for free - DUB and SUB available,"watch Egumi Legacy online free, Egumi Legacy download, free Egumi Legacy stream, Egumi Legacy DUB, Egumi Legacy SUB",17,0,170,"['Egumi Legacy', 'Egumi Legacy']",['Studio Outrigger'],0,3,"['Login', 'Register', 'Browser', 'Genre', 'Random', 'FAQ', 'Option', '', 'Browse', 'Random', 'Genre', '', 'Comedy', 'Studio Outrigger', 'TV Series', 'Studio Outrigger', 'Comedy']"
https://4anime.gg/bye-bye-earth-19226,3,"Watch Bye Bye, Earth online free on 4anime","Watch Bye Bye, Earth in HD quality and download Bye Bye, Earth HD version for free - DUB and SUB available","watch Bye Bye, Earth online free, Bye Bye, Earth download, free Bye Bye, Earth stream, Bye Bye, Earth DUB, Bye Bye, Earth SUB",21,0,176,"['Bye Bye, Earth', 'Bye Bye, Earth']",['LIDENFILMS'],0,3,"['Login', 'Register', 'Browser', 'Genre', 'Random', 'FAQ', 'Option', '', 'Browse', 'Random', 'Genre', '', 'Action', 'Adventure', 'Fantasy', 'LIDENFILMS', 'TV Series', 'LIDENFILMS', 'Action', 'Adventure', 'Fantasy']"
https://4anime.gg/yatagarasu-the-raven-does-not-choose-its-master-19104,3,Watch Yatagarasu: The Raven Does Not Choose Its Master online free on 4anime,Watch Yatagarasu: The Raven Does Not Choose Its Master in HD quality and download Yatagarasu: The Raven Does Not Choose Its Master HD version for free - DUB and SUB available,"watch Yatagarasu: The Raven Does Not Choose Its Master online free, Yatagarasu: The Raven Does Not Choose Its Master download, free Yatagarasu: The Raven Does Not Choose Its Master stream, Yatagarasu: The Raven Does Not Choose Its Master DUB, Yatagarasu: The Raven Does Not Choose Its Master SUB",23,0,275,"['Yatagarasu: The Raven Does Not Choose Its Master', 'Yatagarasu: The Raven Does Not Choose Its Master']",['Pierrot'],0,3,"['Login', 'Register', 'Browser', 'Genre', 'Random', 'FAQ', 'Option', '', 'Browse', 'Random', 'Genre', '', 'Action', 'Fantasy', 'Historical', 'Supernatural', 'Pierrot', 'TV Series', 'Pierrot', 'Action', 'Fantasy', 'Historical', 'Supernatural']"
https://4anime.gg/shoshimin-how-to-become-ordinary-19242,3,Watch Shoshimin: How to Become Ordinary online free on 4anime,Watch Shoshimin: How to Become Ordinary in HD quality and download Shoshimin: How to Become Ordinary HD version for free - DUB and SUB available,"watch Shoshimin: How to Become Ordinary online free, Shoshimin: How to Become Ordinary download, free Shoshimin: How to Become Ordinary stream, Shoshimin: How to Become Ordinary DUB, Shoshimin: How to Become Ordinary SUB",19,0,202,"['Shoshimin: How to Become Ordinary', 'Shoshimin: How to Become Ordinary']",['Lapin Track'],0,3,"['Login', 'Register', 'Browser', 'Genre', 'Random', 'FAQ', 'Option', '', 'Browse', 'Random', 'Genre', '', 'Mystery', 'School', 'Lapin Track', 'TV Series', 'Lapin Track', 'Mystery', 'School']"
https://4anime.gg/the-fable-19120,3,Watch The Fable online free on 4anime,Watch The Fable in HD quality and download The Fable HD version for free - DUB and SUB available,"watch The Fable online free, The Fable download, free The Fable stream, The Fable DUB, The Fable SUB",25,0,246,"['The Fable', 'The Fable']",['Tezuka Productions'],0,3,"['Login', 'Register', 'Browser', 'Genre', 'Random', 'FAQ', 'Option', '', 'Browse', 'Random', 'Genre', '', 'Action', 'Comedy', 'Drama', 'Romance', 'Seinen', 'Tezuka Productions', 'TV Series', 'Tezuka Productions', 'Action', 'Comedy', 'Drama', 'Romance', 'Seinen']"
https://4anime.gg/grendizer-u-19212,3,Watch Grendizer U online free on 4anime,Watch Grendizer U in HD quality and download Grendizer U HD version for free - DUB and SUB available,"watch Grendizer U online free, Grendizer U download, free Grendizer U stream, Grendizer U DUB, Grendizer U SUB",23,0,167,"['Grendizer U', 'Grendizer U']",['Gaina'],0,3,"['Login', 'Register', 'Browser', 'Genre', 'Random', 'FAQ', 'Option', '', 'Browse', 'Random', 'Genre', '', 'Action', 'Adventure', 'Mecha', 'Sci-Fi', 'Gaina', 'TV Series', 'Gaina', 'Action', 'Adventure', 'Mecha', 'Sci-Fi']"
https://4anime.gg/quality-assurance-in-another-world-19221,3,Watch Quality Assurance in Another World online free on 4anime,Watch Quality Assurance in Another World in HD quality and download Quality Assurance in Another World HD version for free - DUB and SUB available,"watch Quality Assurance in Another World online free, Quality Assurance in Another World download, free Quality Assurance in Another World stream, Quality Assurance in Another World DUB, Quality Assurance in Another World SUB",23,0,166,"['Quality Assurance in Another World', 'Quality Assurance in Another World']","['Studio Palette,Animation Staff Room']",0,3,"['Login', 'Register', 'Browser', 'Genre', 'Random', 'FAQ', 'Option', '', 'Browse', 'Random', 'Genre', '', 'Adventure', 'Comedy', 'Fantasy', 'Studio Palette', 'Animation Staff Room', 'TV Series', 'Studio Palette', 'Animation Staff Room', 'Adventure', 'Comedy', 'Fantasy']"
https://4anime.gg/sakuna-of-rice-and-ruin-19215,3,Watch Sakuna: Of Rice and Ruin online free on 4anime,Watch Sakuna: Of Rice and Ruin in HD quality and download Sakuna: Of Rice and Ruin HD version for free - DUB and SUB available,"watch Sakuna: Of Rice and Ruin online free, Sakuna: Of Rice and Ruin download, free Sakuna: Of Rice and Ruin stream, Sakuna: Of Rice and Ruin DUB, Sakuna: Of Rice and Ruin SUB",19,0,179,"['Sakuna: Of Rice and Ruin', 'Sakuna: Of Rice and Ruin']",['P.A. Works'],0,3,"['Login', 'Register', 'Browser', 'Genre', 'Random', 'FAQ', 'Option', '', 'Browse', 'Random', 'Genre', '', 'Action', 'Fantasy', 'P.A. Works', 'TV Series', 'P.A. Works', 'Action', 'Fantasy']"
https://4anime.gg/a-nobodys-way-up-to-an-exploration-hero-lv-19223,3,Watch A Nobody's Way Up to an Exploration Hero LV online free on 4anime,Watch A Nobody's Way Up to an Exploration Hero LV in HD quality and download A Nobody's Way Up to an Exploration Hero LV HD version for free - DUB and SUB available,"watch A Nobody's Way Up to an Exploration Hero LV online free, A Nobody's Way Up to an Exploration Hero LV download, free A Nobody's Way Up to an Exploration Hero LV stream, A Nobody's Way Up to an Exploration Hero LV DUB, A Nobody's Way Up to an Exploration Hero LV SUB",21,0,202,"[""A Nobody's Way Up to an Exploration Hero LV"", ""A Nobody's Way Up to an Exploration Hero LV""]",['Gekkou'],0,3,"['Login', 'Register', 'Browser', 'Genre', 'Random', 'FAQ', 'Option', '', 'Browse', 'Random', 'Genre', '', 'Action', 'Adventure', 'Fantasy', 'Gekkou', 'TV Series', 'Gekkou', 'Action', 'Adventure', 'Fantasy']"
https://4anime.gg/suna-no-bara-yuki-no-mokushiroku-6947,3,Watch Suna no Bara: Yuki no Mokushiroku online free on 4anime,Watch Suna no Bara: Yuki no Mokushiroku in HD quality and download Suna no Bara: Yuki no Mokushiroku HD version for free - DUB and SUB available,"watch Suna no Bara: Yuki no Mokushiroku online free, Suna no Bara: Yuki no Mokushiroku download, free Suna no Bara: Yuki no Mokushiroku stream, Suna no Bara: Yuki no Mokushiroku DUB, Suna no Bara: Yuki no Mokushiroku SUB",17,0,120,"['Suna no Bara: Yuki no Mokushiroku', 'Suna no Bara: Yuki no Mokushiroku']",['J.C.Staff'],0,3,"['Login', 'Register', 'Browser', 'Genre', 'Random', 'FAQ', 'Option', '', 'Browse', 'Random', 'Genre', '', 'Action', 'J.C.Staff', 'OVA', 'J.C.Staff', 'Action']"
