url,depth,title,meta_description,meta_keywords,internal_link_count,external_link_count,word_count,h1_tags,h2_tags,main_word_count,image_count,link_texts
https://4anime.gg/mission-yozakura-family-19133,2,Watch Mission: Yozakura Family online free on 4anime,Watch Mission: Yozakura Family in HD quality and download Mission: Yozakura Family HD version for free - DUB and SUB available,"watch Mission: Yozakura Family online free, Mission: Yozakura Family download, free Mission: Yozakura Family stream, Mission: Yozakura Family DUB, Mission: Yozakura Family SUB",23,0,208,"['Mission: Yozakura Family', 'Mission: Yozakura Family']",['Silver Link.'],0,3,"['Login', 'Register', 'Browser', 'Genre', 'Random', 'FAQ', 'Option', '', 'Browse', 'Random', 'Genre', '', 'Action', 'Comedy', 'Romance', 'Shounen', 'Silver Link.', 'TV Series', 'Silver Link.', 'Action', 'Comedy', 'Romance', 'Shounen']"
https://4anime.gg/the-elusive-samurai-19233,2,Watch The Elusive Samurai online free on 4anime,Watch The Elusive Samurai in HD quality and download The Elusive Samurai HD version for free - DUB and SUB available,"watch The Elusive Samurai online free, The Elusive Samurai download, free The Elusive Samurai stream, The Elusive Samurai DUB, The Elusive Samurai SUB",21,0,195,"['The Elusive Samurai', 'The Elusive Samurai']",['CloverWorks'],0,3,"['Login', 'Register', 'Browser', 'Genre', 'Random', 'FAQ', 'Option', '', 'Browse', 'Random', 'Genre', '', 'Action', 'Adventure', 'Comedy', 'CloverWorks', 'TV Series', 'CloverWorks', 'Action', 'Adventure', 'Comedy']"
https://4anime.gg/studio/cloverworks,3,Watch CloverWorks anime online for Free on 9anime,Here on 9anime you can find all the latest and famous anime from CloverWorks in HD Quality 1080. Watch and Download now,"CloverWorks anime, CloverWorks info, CloverWorks download, CloverWorks watch, 9anime, free anime online, watch anime",116,0,301,[],['CloverWorks Studio Anime'],0,36,"['Login', 'Register', 'Browser', 'Genre', 'Random', 'FAQ', 'Option', '', 'Browse', 'Random', 'Genre', '', '', 'Fate/Grand Order: Zettai Majuu Sensen Babylonia - Initium Iter', 'Episode 1', '', ""DAKAICHI -I'm being harassed by the sexiest man of the year-"", 'Episode 13', '', 'DARLING in the FRANXX', 'Episode 24', '', 'Fairy Tail Final Series', 'Episode 51', '', 'Fate/Grand Order: Absolute Demonic Front - Babylonia', 'Episode 21', '', 'Horimiya', 'Episode 13', '', 'Ace Attorney Season 2', 'Episode 23', '', 'Rascal Does Not Dream of Bunny Girl Senpai', 'Episode 13', '', 'Slow Start', 'Episode 12', '', 'The Promised Neverland', 'Episode 12', '', 'The Millionaire Detective – Balance: UNLIMITED', 'Episode 11', '', 'Rascal Does Not Dream of a Dreaming Girl', 'Episode 1', '', 'Saenai Heroine no Sodatekata Fine', 'Episode 1', '', 'Fate/Grand Order: Shuukyoku Tokuiten - Kani Jikan Shinden Solomon', 'Episode 1', '', 'Tokyo 24-ku: Reversal Film', 'Episode 1', '', ""Akebi's Sailor Uniform"", 'Episode 12', '', 'My Dress-Up Darling', 'Episode 12', '', 'Norimono Man: Mobile Land no Car-kun', 'Episode 52', '', 'Persona 5 the Animation TV Specials', 'Episode 2', '', 'Persona 5 the Animation Specials', 'Episode 2', '', 'Tokyo Twenty Fourth Ward', 'Episode 12', '', 'Persona 5 The Animation', 'Episode 26', '', 'In the Heart of Kunoichi Tsubaki', 'Episode 13', '', 'Shadows House 2nd Season', 'Episode 12', '', 'Spy x Family', 'Episode 12', '', 'Bocchi the Rock!', 'Episode 12', '', 'Spy x Family, Part 2', 'Episode 13', '', 'Seishun Buta Yarou wa Bunny Girl Senpai no Yume wo Minai Picture Drama', 'Episode 5', '', 'UniteUp!', 'Episode 12', '', 'Horimiya: The Missing Pieces', 'Episode 13', '', 'Spy x Family Season 2', 'Episode 12', '', 'Rascal Does Not Dream of a Sister Venturing Out', 'Episode 1', '', 'Black Butler: Public School Arc', 'Episode 11', '', 'Wind Breaker', 'Episode 13', '2', '›']"
https://4anime.gg/my-hero-academia-season-7-19146,2,Watch My Hero Academia Season 7 online free on 4anime,Watch My Hero Academia Season 7 in HD quality and download My Hero Academia Season 7 HD version for free - DUB and SUB available,"watch My Hero Academia Season 7 online free, My Hero Academia Season 7 download, free My Hero Academia Season 7 stream, My Hero Academia Season 7 DUB, My Hero Academia Season 7 SUB",25,0,104,"['My Hero Academia Season 7', 'My Hero Academia Season 7']",['Bones'],0,3,"['Login', 'Register', 'Browser', 'Genre', 'Random', 'FAQ', 'Option', '', 'Browse', 'Random', 'Genre', '', 'Action', 'Adventure', 'School', 'Shounen', 'Super Power', 'Bones', 'TV Series', 'Bones', 'Action', 'Adventure', 'School', 'Shounen', 'Super Power']"
https://4anime.gg/genre/super-power,3,Watch Super Power Anime Online Free,Free Super Power Anime Streaming with both Subbed and Dubbed. Download Super Power anime online FREE from Zoro.to website.,"watch Super Power anime, free Super Power anime, download Super Power anime, latest Super Power anime, dubbed Super Power anime, subbed Super Power anime, most watched Super Power anime",121,0,294,[],['Genre Super Power'],0,37,"['Login', 'Register', 'Browser', 'Genre', 'Random', 'FAQ', 'Option', '', 'Browse', 'Random', 'Genre', '', '', 'My Hero Academia Season 2: Hero Notebook', 'Episode 1', '', 'Dragon Ball: Super Saiya-jin Zetsumetsu Keikaku', 'Episode 1', '', '[RAW] Esper Mami Special: My Angel Mami-chan', 'Episode 1', '', '[RAW] Ultra B', 'Episode 117', '', 'My Hero Academia: Make It! Do-or-Die Survival Training', 'Episode 2', '', 'Hunter x Hunter', 'Episode 148', '', 'Hunter x Hunter', 'Episode 62', '', 'Attack on Titan Season 2', 'Episode 12', '', 'Attack on Titan Season 3', 'Episode 22', '', 'One Punch Man 2nd Season Specials', 'Episode 6', '', 'One Punch Man Specials', 'Episode 6', '', 'One Punch Man: Road to Hero', 'Episode 1', '', '[RAW] Tottemo! Luckyman', 'Episode 50', '', 'My Hero Academia 2', 'Episode 25', '', 'My Hero Academia 3', 'Episode 25', '', 'My Hero Academia 4', 'Episode 25', '', 'Killer Seven', 'Episode 4', '', 'Ikkitousen: Dragon Destiny Specials', 'Episode 6', '', 'Sorcerer Hunters', 'Episode 3', '', 'Dies irae: The Dawning Days', 'Episode 1', '', 'Attack on Titan OVA', 'Episode 3', '', 'Naruto: Shippuuden Movie 6: Road to Ninja', 'Episode 1', '', 'A Certain Scientific Accelerator', 'Episode 12', '', 'Naruto OVA5: Naruto, The Genie, and The Three Wishes!!', 'Episode 1', '', 'Naruto OVA9: Sunny Side Battle', 'Episode 1', '', 'Boruto: Naruto the Movie - The Day Naruto Became the Hokage', 'Episode 1', '', 'Darker than Black: Gaiden', 'Episode 4', '', 'Night Raid 1931 Specials', 'Episode 3', '', 'Night Raid 1931: The Prophecy', 'Episode 1', '', '[RAW] Esper Mami', 'Episode 119', '', '[RAW] Perman (1983)', 'Episode 526', '', 'Charlotte: Tsuyoimono-tachi', 'Episode 1', '', 'Speed Grapher', 'Episode 24', '', 'Ikkitousen: Shuugaku Toushi Keppuuroku', 'Episode 1', '', 'Baka & Test - Summon the Beasts OVA: Matsuri', 'Episode 2', '2', '3', '›', '»']"
https://4anime.gg/studio/bones,3,Watch Bones anime online for Free on 9anime,Here on 9anime you can find all the latest and famous anime from Bones in HD Quality 1080. Watch and Download now,"Bones anime, Bones info, Bones download, Bones watch, 9anime, free anime online, watch anime",118,0,283,[],['Bones Studio Anime'],0,36,"['Login', 'Register', 'Browser', 'Genre', 'Random', 'FAQ', 'Option', '', 'Browse', 'Random', 'Genre', '', '', ""Wolf's Rain OVA"", 'Episode 4', '', 'Mob Psycho 100: Dai Ikkai Rei toka Soudansho Ian Ryokou - Kokoro Mitasu Iyashi no Tabi', 'Episode 1', '', 'My Hero Academia Season 2: Hero Notebook', 'Episode 1', '', 'Mob Psycho 100: Reigen - Shirarezaru Kiseki no Reinouryokusha', 'Episode 1', '', 'My Hero Academia: Make It! Do-or-Die Survival Training', 'Episode 2', '', 'My Hero Academia 2', 'Episode 25', '', 'My Hero Academia 3', 'Episode 25', '', 'My Hero Academia 4', 'Episode 25', '', 'No. 6', 'Episode 11', '', 'Snow White with the Red Hair 2', 'Episode 12', '', 'Darker than Black: Beneath Cherry Blossoms In Full Bloom', 'Episode 1', '', 'Darker than Black: Gaiden', 'Episode 4', '', 'Eureka Seven', 'Episode 50', '', 'Hitsugi no Chaika OVA', 'Episode 1', '', 'Ghost Slayers Ayashi: Inferno', 'Episode 5', '', 'A.I.C.O.: Incarnation', 'Episode 12', '', 'Blast of Tempest', 'Episode 24', '', 'Bungo Stray Dogs', 'Episode 12', '', 'Bungo Stray Dogs 2', 'Episode 13', '', 'Bungou Stray Dogs 3rd Season', 'Episode 12', '', 'Bungo Stray Dogs Wan!', 'Episode 12', '', 'Battle Doll Angelic Layer', 'Episode 26', '', 'Carole & Tuesday', 'Episode 24', '', 'Chaika -The Coffin Princess- Avenging Battle', 'Episode 10', '', 'Chaika -The Coffin Princess-', 'Episode 12', '', 'Dragon Pilot: Hisone and Masotan', 'Episode 12', '', 'Darker than Black', 'Episode 25', '', 'Darker than Black: Gemini of the Meteor', 'Episode 12', '', 'Eureka Seven: Astral Ocean', 'Episode 24', '', 'Aratanari Fukaki Ao', 'Episode 10', '', 'Fullmetal Alchemist: Brotherhood', 'Episode 64', '', 'Fullmetal Alchemist', 'Episode 51', '', 'Ghost Slayers Ayashi', 'Episode 30', '', 'Gosick', 'Episode 24', '2', '3', '›', '»']"
https://4anime.gg/fight-da-pyuta-13567,2,Watch Fight Da!! Pyuta online free on 4anime,Watch Fight Da!! Pyuta in HD quality and download Fight Da!! Pyuta HD version for free - DUB and SUB available,"watch Fight Da!! Pyuta online free, Fight Da!! Pyuta download, free Fight Da!! Pyuta stream, Fight Da!! Pyuta DUB, Fight Da!! Pyuta SUB",21,0,97,"['Fight Da!! Pyuta', 'Fight Da!! Pyuta']",[''],0,3,"['Login', 'Register', 'Browser', 'Genre', 'Random', 'FAQ', 'Option', '', 'Browse', 'Random', 'Genre', '', 'Action', 'Comedy', 'Sci-Fi', 'Shounen', 'TV Series', 'Action', 'Comedy', 'Sci-Fi', 'Shounen']"
https://4anime.gg/cardfight-vanguard-divinez-season-2-19206,2,Watch Cardfight!! Vanguard: Divinez Season 2 online free on 4anime,Watch Cardfight!! Vanguard: Divinez Season 2 in HD quality and download Cardfight!! Vanguard: Divinez Season 2 HD version for free - DUB and SUB available,"watch Cardfight!! Vanguard: Divinez Season 2 online free, Cardfight!! Vanguard: Divinez Season 2 download, free Cardfight!! Vanguard: Divinez Season 2 stream, Cardfight!! Vanguard: Divinez Season 2 DUB, Cardfight!! Vanguard: Divinez Season 2 SUB",25,0,111,"['Cardfight!! Vanguard: Divinez Season 2', 'Cardfight!! Vanguard: Divinez Season 2']","['Studio JEMI,Kinema Citrus,Gift-o’-Animation']",0,3,"['Login', 'Register', 'Browser', 'Genre', 'Random', 'FAQ', 'Option', '', 'Browse', 'Random', 'Genre', '', 'Action', 'Adventure', 'Game', 'Studio JEMI', 'Kinema Citrus', 'Gift-o’-Animation', 'TV Series', 'Studio JEMI', 'Kinema Citrus', 'Gift-o’-Animation', 'Action', 'Adventure', 'Game']"
https://4anime.gg/studio/studio-jemi,3,"Watch , Studio Jemi anime online for Free on 9anime","Here on 9anime you can find all the latest and famous anime from , Studio Jemi in HD Quality 1080. Watch and Download now",", Studio Jemi anime, , Studio Jemi info, , Studio Jemi download, , Studio Jemi watch, 9anime, free anime online, watch anime",15,0,65,[],"[', Studio Jemi Studio Anime']",0,3,"['Login', 'Register', 'Browser', 'Genre', 'Random', 'FAQ', 'Option', '', 'Browse', 'Random', 'Genre', '', '', 'Cardfight!! Vanguard: overDress Season 2', 'Episode 13']"
https://4anime.gg/studio/kinema-citrus,3,Watch Kinema Citrus anime online for Free on 9anime,Here on 9anime you can find all the latest and famous anime from Kinema Citrus in HD Quality 1080. Watch and Download now,"Kinema Citrus anime, Kinema Citrus info, Kinema Citrus download, Kinema Citrus watch, 9anime, free anime online, watch anime",116,0,265,[],['Kinema Citrus Studio Anime'],0,36,"['Login', 'Register', 'Browser', 'Genre', 'Random', 'FAQ', 'Option', '', 'Browse', 'Random', 'Genre', '', '', '.hack//Quantum', 'Episode 3', '', 'Black Bullet', 'Episode 13', '', 'Barakamon', 'Episode 12', '', 'Code:Breaker', 'Episode 13', '', 'Is the Order a Rabbit??', 'Episode 12', '', 'Made in Abyss', 'Episode 13', '', 'Mijikamon', 'Episode 13', '', 'Revue Starlight', 'Episode 12', '', 'Scorching Ping Pong Girls', 'Episode 12', '', 'Show By Rock!! Mashumairesh!!', 'Episode 12', '', 'The Rising of the Shield Hero', 'Episode 25', '', 'Tokyo Magnitude 8.0', 'Episode 11', '', 'Eureka Seven - good night, sleep tight, young lovers', 'Episode 1', '', ""Made in Abyss Movie 1: Journey's Dawn"", 'Episode 1', '', 'Made in Abyss Movie 2: Wandering Twilight', 'Episode 1', '', 'Made in Abyss Movie 3: Dawn of the Deep Soul', 'Episode 1', '', ""Maruruk's Everday"", 'Episode 4', '', 'Shoujo☆Kageki Revue Starlight: Rondo Rondo Rondo', 'Episode 1', '', 'Cardfight!! Vanguard: overDress Season 2', 'Episode 13', '', 'Kuma Miko Specials', 'Episode 2', '', 'Kumamiko: Girl Meets Bear', 'Episode 12', '', 'Show by Rock!! Stars!!', 'Episode 12', '', 'Neppuu Kairiku Bushi Road', 'Episode 1', '', 'Yuyushiki', 'Episode 12', '', 'Yuyushiki: Komarasetari, Komarasaretari', 'Episode 1', '', 'The Rising of the Shield Hero 2nd Season', 'Episode 13', '', 'Cardfight!! Vanguard: overDress Season 3', 'Episode 13', '', 'Higepiyo', 'Episode 39', '', 'Cardfight!! Vanguard: will+Dress Season 2', 'Episode 12', '', 'Cardfight!! Vanguard: will+Dress Season 3', 'Episode 13', '', 'The Rising of the Shield Hero Season 3', 'Episode 12', '', 'My Happy Marriage', 'Episode 12', '', 'Cardfight!! Vanguard: Divinez', 'Episode 13', '', 'Nagareboshi Lens', 'Episode 1', '2', '›']"
https://4anime.gg/studio/gift-o-animation,3,Watch Gift-o’-Animation anime online for Free on 9anime,Here on 9anime you can find all the latest and famous anime from Gift-o’-Animation in HD Quality 1080. Watch and Download now,"Gift-o’-Animation anime, Gift-o’-Animation info, Gift-o’-Animation download, Gift-o’-Animation watch, 9anime, free anime online, watch anime",15,0,61,[],['Gift-o’-Animation Studio Anime'],0,3,"['Login', 'Register', 'Browser', 'Genre', 'Random', 'FAQ', 'Option', '', 'Browse', 'Random', 'Genre', '', '', 'Cardfight!! Vanguard: Divinez Season 2', 'Episode 13']"
https://4anime.gg/i-parry-everything-19229,2,Watch I Parry Everything online free on 4anime,Watch I Parry Everything in HD quality and download I Parry Everything HD version for free - DUB and SUB available,"watch I Parry Everything online free, I Parry Everything download, free I Parry Everything stream, I Parry Everything DUB, I Parry Everything SUB",21,0,243,"['I Parry Everything', 'I Parry Everything']",['OLM'],0,3,"['Login', 'Register', 'Browser', 'Genre', 'Random', 'FAQ', 'Option', '', 'Browse', 'Random', 'Genre', '', 'Action', 'Adventure', 'Fantasy', 'OLM', 'TV Series', 'OLM', 'Action', 'Adventure', 'Fantasy']"
https://4anime.gg/monogatari-series-off-monster-season-19202,2,Watch Monogatari Series: Off & Monster Season online free on 4anime,Watch Monogatari Series: Off & Monster Season in HD quality and download Monogatari Series: Off & Monster Season HD version for free - DUB and SUB available,"watch Monogatari Series: Off & Monster Season online free, Monogatari Series: Off & Monster Season download, free Monogatari Series: Off & Monster Season stream, Monogatari Series: Off & Monster Season DUB, Monogatari Series: Off & Monster Season SUB",23,0,297,"['Monogatari Series: Off & Monster Season', 'Monogatari Series: Off & Monster Season']",['Shaft'],0,3,"['Login', 'Register', 'Browser', 'Genre', 'Random', 'FAQ', 'Option', '', 'Browse', 'Random', 'Genre', '', 'Comedy', 'Mystery', 'Vampire', 'Supernatural', 'Shaft', 'ONA', 'Shaft', 'Comedy', 'Mystery', 'Vampire', 'Supernatural']"
https://4anime.gg/laid-back-camp-242,2,Watch Laid-Back Camp online free on 4anime,Watch Laid-Back Camp in HD quality and download Laid-Back Camp HD version for free - DUB and SUB available,"watch Laid-Back Camp online free, Laid-Back Camp download, free Laid-Back Camp stream, Laid-Back Camp DUB, Laid-Back Camp SUB",19,0,268,"['Laid-Back Camp', 'Laid-Back Camp']",['C-Station'],0,3,"['Login', 'Register', 'Browser', 'Genre', 'Random', 'FAQ', 'Option', '', 'Browse', 'Random', 'Genre', '', 'Comedy', 'Slice of Life', 'C-Station', 'TV Series', 'C-Station', 'Comedy', 'Slice of Life']"
https://4anime.gg/studio/c-station,3,Watch C-Station anime online for Free on 9anime,Here on 9anime you can find all the latest and famous anime from C-Station in HD Quality 1080. Watch and Download now,"C-Station anime, C-Station info, C-Station download, C-Station watch, 9anime, free anime online, watch anime",54,0,124,[],['C-Station Studio Anime'],0,16,"['Login', 'Register', 'Browser', 'Genre', 'Random', 'FAQ', 'Option', '', 'Browse', 'Random', 'Genre', '', '', 'Dragonar Academy', 'Episode 12', '', 'Hakyu Hoshin Engi', 'Episode 24', '', 'Room Camp', 'Episode 12', '', 'Starmyu', 'Episode 12', '', 'Starmyu 2nd Season', 'Episode 12', '', 'Starmyu 3rd Season', 'Episode 12', '', 'Laid-Back Camp', 'Episode 12', '', 'Heya Camp△: Sauna to Gohan to Sanrin Bike', 'Episode 1', '', 'Yuru Camp△ Specials', 'Episode 3', '', 'Yuru Camp△ Movie', 'Episode 1', '', 'Laid-Back Camp Season 2 Specials', 'Episode 2', '', 'Opus.COLORs', 'Episode 12', '', 'Laid-Back Camp 2nd Season', 'Episode 13', '', 'Kinoko Inu', 'Episode 4']"
https://4anime.gg/dorami-chan-wow-the-kid-gang-of-bandits-13458,2,"Watch Dorami-chan: Wow, The Kid Gang of Bandits online free on 4anime","Watch Dorami-chan: Wow, The Kid Gang of Bandits in HD quality and download Dorami-chan: Wow, The Kid Gang of Bandits HD version for free - DUB and SUB available","watch Dorami-chan: Wow, The Kid Gang of Bandits online free, Dorami-chan: Wow, The Kid Gang of Bandits download, free Dorami-chan: Wow, The Kid Gang of Bandits stream, Dorami-chan: Wow, The Kid Gang of Bandits DUB, Dorami-chan: Wow, The Kid Gang of Bandits SUB",15,0,107,"['Dorami-chan: Wow, The Kid Gang of Bandits', 'Dorami-chan: Wow, The Kid Gang of Bandits']",[''],0,3,"['Login', 'Register', 'Browser', 'Genre', 'Random', 'FAQ', 'Option', '', 'Browse', 'Random', 'Genre', '', 'Fantasy', 'Movie', 'Fantasy']"
https://4anime.gg/movie,3,4anime - Watch Anime online free with English DUB and SUB,Free anime website with real 1080 HD quality with English subtitle - Just sit back and relax!,"4anime, 4 anime, 4animeto, watch anime online, free anime, anime free, online anime, anime website",121,0,314,[],['Movie Anime'],0,37,"['Login', 'Register', 'Browser', 'Genre', 'Random', 'FAQ', 'Option', '', 'Browse', 'Random', 'Genre', '', '', 'Spy x Family Code: White', 'Episode 1', '', 'Be Forever Yamato: Rebel 3199', 'Episode 1', '', 'IDOLiSH7 Movie: LIVE 4bit - BEYOND THE PERiOD', 'Episode 2', '', 'Blue Lock: Episode Nagi', 'Episode 1', '', 'My Oni Girl', 'Episode 1', '', 'Kuramerukagari', 'Episode 1', '', 'Rascal Does Not Dream of a Sister Venturing Out', 'Episode 1', '', 'Dead Dead Demons Dededede Destruction', 'Episode 1', '', 'Oomuro-ke: Dear Sisters', 'Episode 1', '', 'Ya Boy Kongming!: Road to Summer Sonia', 'Episode 1', '', 'Mobile Suit Gundam SEED Freedom', 'Episode 1', '', 'Psycho-Pass Movie: Providence', 'Episode 1', '', 'White Snake 2: The Tribulation of the Green Snake', 'Episode 1', '', 'Detective Conan Movie 26: Black Iron Submarine', 'Episode 1', '', 'My Hero Academia: UA Heroes Battle', 'Episode 1', '', 'Digimon Adventure 02 Movie', 'Episode 1', '', 'The Imaginary', 'Episode 1', '', 'I Am What I Am', 'Episode 1', '', 'The Summer', 'Episode 1', '', 'Boonie Bears: Back to Earth', 'Episode', '', 'Boonie Bears: The Wild Life', 'Episode', '', 'Free! Movie 5: The Final Stroke - Kouhen', 'Episode 1', '', 'Maboroshi', 'Episode 1', '', 'Sound! Euphonium: Ensemble Contest Arc', 'Episode 1', '', 'Kaina of the Great Snow Sea: Star Sage', 'Episode 1', '', 'Resident Evil: Death Island', 'Episode', '', 'Detective Conan Movie: The Story of Haibara Ai - Black Iron Mystery Train', 'Episode 1', '', 'Tsurune Movie: Hajimari no Issha', 'Episode 1', '', 'Backflip!! The Movie', 'Episode 1', '', ""Mobile Suit Gundam: Cucuruz Doan's Island"", 'Episode 1', '', 'World, Before You End', 'Episode 1', '', 'Kaguya-sama: Love is War - The First Kiss That Never Ends', 'Episode 4', '', 'The Tunnel to Summer, the Exit of Goodbye', 'Episode 1', '', 'Delicious Party♡Pretty Cure Movie', 'Episode 1', '', 'Goodbye, Don Glees!', 'Episode 1', '2', '3', '›', '»']"
https://4anime.gg/uzumaki-spiral-into-horror-15600,2,Watch Uzumaki: Spiral into Horror online free on 4anime,Watch Uzumaki: Spiral into Horror in HD quality and download Uzumaki: Spiral into Horror HD version for free - DUB and SUB available,"watch Uzumaki: Spiral into Horror online free, Uzumaki: Spiral into Horror download, free Uzumaki: Spiral into Horror stream, Uzumaki: Spiral into Horror DUB, Uzumaki: Spiral into Horror SUB",29,0,207,"['Uzumaki: Spiral into Horror', 'Uzumaki: Spiral into Horror']",['Drive'],0,3,"['Login', 'Register', 'Browser', 'Genre', 'Random', 'FAQ', 'Option', '', 'Browse', 'Random', 'Genre', '', 'Dementia', 'Drama', 'Horror', 'Romance', 'Supernatural', 'Psychological', 'Seinen', 'Drive', 'TV Series', 'Drive', 'Dementia', 'Drama', 'Horror', 'Romance', 'Supernatural', 'Psychological', 'Seinen']"
https://4anime.gg/genre/dementia,3,Watch Dementia Anime Online Free,Free Dementia Anime Streaming with both Subbed and Dubbed. Download Dementia anime online FREE from Zoro.to website.,"watch Dementia anime, free Dementia anime, download Dementia anime, latest Dementia anime, dubbed Dementia anime, subbed Dementia anime, most watched Dementia anime",119,0,242,[],['Genre Dementia'],0,37,"['Login', 'Register', 'Browser', 'Genre', 'Random', 'FAQ', 'Option', '', 'Browse', 'Random', 'Genre', '', '', 'Puparia', 'Episode 1', '', 'FLCL', 'Episode 6', '', 'FLCL Alternative', 'Episode 6', '', 'FLCL Progressive', 'Episode 6', '', 'AD Police Files', 'Episode 3', '', 'Boogiepop Phantom', 'Episode 12', '', 'Devilman: Crybaby', 'Episode 10', '', 'When They Cry', 'Episode 26', '', 'Higurashi: When They Cry – Gou', 'Episode 24', '', ""King's Game"", 'Episode 12', '', 'Neon Genesis Evangelion', 'Episode 26', '', 'Paranoia Agent', 'Episode 13', '', 'Penguindrum', 'Episode 24', '', 'Pop Team Epic', 'Episode 12', '', 'Serial Experiments Lain', 'Episode 13', '', 'Yami Shibai 8', 'Episode 13', '', 'Yamishibai: Japanese Ghost Stories', 'Episode 13', '', 'Yamishibai: Japanese Ghost Stories 2', 'Episode 13', '', 'Yamishibai: Japanese Ghost Stories 3', 'Episode 13', '', 'Yamishibai: Japanese Ghost Stories 4', 'Episode 13', '', 'Yamishibai: Japanese Ghost Stories 5', 'Episode 13', '', 'Yamishibai: Japanese Ghost Stories 6', 'Episode 13', '', 'Yamishibai: Japanese Ghost Stories 7', 'Episode 13', '', 'Yami Shibai 9', 'Episode 13', '', 'Genius Party', 'Episode 1', '', 'Genius Party Beyond', 'Episode 1', '', 'Neon Genesis Evangelion Movie: The End of Evangelion', 'Episode 1', '', 'Paprika', 'Episode 1', '', 'Perfect Blue', 'Episode 1', '', 'Panty & Stocking in Sanitarybox', 'Episode 1', '', 'Revolutionary Girl Utena: The Adolescence of Utena', 'Episode 1', '', ""Angel's Egg"", 'Episode 1', '', 'Higurashi: When They Cry – SOTSU', 'Episode 15', '', 'Yami Shibai 10', 'Episode 13', '', 'Adventures in Beauty Wonderland', 'Episode 1', '2', '›']"
https://4anime.gg/genre/horror,3,Watch Horror Anime Online Free,Free Horror Anime Streaming with both Subbed and Dubbed. Download Horror anime online FREE from Zoro.to website.,"watch Horror anime, free Horror anime, download Horror anime, latest Horror anime, dubbed Horror anime, subbed Horror anime, most watched Horror anime",121,0,253,[],['Genre Horror'],0,37,"['Login', 'Register', 'Browser', 'Genre', 'Random', 'FAQ', 'Option', '', 'Browse', 'Random', 'Genre', '', '', 'Neo Ranga', 'Episode 48', '', 'Spooky Kitaro: Giant Sea Monster', 'Episode 1', '', '[RAW] Kaibutsu-kun (1980)', 'Episode 188', '', '[RAW] Akuma-kun', 'Episode 42', '', '[RAW] Oretacha Youkai Ningen G', 'Episode 25', '', '[RAW] Youkai Ningen Bem', 'Episode 26', '', ""JoJo's Bizarre Adventure"", 'Episode 6', '', ""JoJo's Bizarre Adventure"", 'Episode 7', '', 'Zombie-Loan', 'Episode 2', '', 'Tomie', 'Episode 2', '', 'Attack on Titan: Lost Girls', 'Episode 3', '', 'Dorohedoro: Ma no Omake', 'Episode 1', '', 'Berserk: The Golden Age Arc III - The Advent', 'Episode 1', '', 'Berserk: The Golden Age Arc II - The Battle for Doldrey', 'Episode 1', '', ""JoJo's Bizarre Adventure: Battle Tendency"", 'Episode 2', '', 'Castlevania', 'Episode 4', '', 'Castlevania 3rd Season', 'Episode 10', '', 'Castlevania 2nd Season', 'Episode 8', '', 'Castlevania 4th Season', 'Episode 10', '', 'Elfen Lied: In the Passing Rain', 'Episode 1', '', 'Trese', 'Episode 6', '', 'Sankarea OVA', 'Episode 2', '', 'Sankarea: I, Too, Am... A Zombie...', 'Episode 1', '', 'Hell Teacher Nube OVA', 'Episode 3', '', 'Shiki Specials', 'Episode 2', '', 'Corpse Party: Missing Footage (Uncensored)', 'Episode 1', '', 'Corpse Party: Tortured Souls (Uncensored)', 'Episode 4', '', '3x3 Eyes', 'Episode 4', '', '3x3 Eyes: Legend of the Divine Demon', 'Episode 3', '', 'Angels of Death', 'Episode 16', '', 'Another', 'Episode 12', '', 'Aooni The Blue Monster', 'Episode 13', '', 'Ajin: Demi-Human', 'Episode 13', '', 'Ajin 2nd Season', 'Episode 13', '', 'Alien 9', 'Episode 4', '2', '3', '›', '»']"
https://4anime.gg/one-piece-fan-letter-19406,2,Watch One Piece Fan Letter online free on 4anime,Watch One Piece Fan Letter in HD quality and download One Piece Fan Letter HD version for free - DUB and SUB available,"watch One Piece Fan Letter online free, One Piece Fan Letter download, free One Piece Fan Letter stream, One Piece Fan Letter DUB, One Piece Fan Letter SUB",21,0,164,"['One Piece Fan Letter', 'One Piece Fan Letter']",['Toei Animation'],0,3,"['Login', 'Register', 'Browser', 'Genre', 'Random', 'FAQ', 'Option', '', 'Browse', 'Random', 'Genre', '', 'Action', 'Adventure', 'Fantasy', 'Toei Animation', 'Special', 'Toei Animation', 'Action', 'Adventure', 'Fantasy']"
