url,depth,title,meta_description,meta_keywords,internal_link_count,external_link_count,word_count,h1_tags,h2_tags,main_word_count,image_count,link_texts
https://4anime.gg/the-most-notorious-talker-runs-the-worlds-greatest-clan-19353,2,"Watch The Most Notorious ""Talker"" Runs the World's Greatest Clan online free on 4anime","Watch The Most Notorious ""Talker"" Runs the World's Greatest Clan in HD quality and download The Most Notorious ""Talker"" Runs the World's Greatest Clan HD version for free - DUB and SUB available","watch The Most Notorious ""Talker"" Runs the World's Greatest Clan online free, The Most Notorious ""Talker"" Runs the World's Greatest Clan download, free The Most Notorious ""Talker"" Runs the World's Greatest Clan stream, The Most Notorious ""Talker"" Runs the World's Greatest Clan DUB, The Most Notorious ""Talker"" Runs the World's Greatest Clan SUB",23,0,178,"['The Most Notorious ""Talker"" Runs the World\'s Greatest Clan', 'The Most Notorious ""Talker"" Runs the World\'s Greatest Clan']","['Ga-Crew,Felix Film']",0,3,"['Login', 'Register', 'Browser', 'Genre', 'Random', 'FAQ', 'Option', '', 'Browse', 'Random', 'Genre', '', 'Action', 'Adventure', 'Fantasy', 'Ga-Crew', 'Felix Film', 'TV Series', 'Ga-Crew', 'Felix Film', 'Action', 'Adventure', 'Fantasy']"
https://4anime.gg/studio/ga-crew,3,Watch Ga-Crew anime online for Free on 9anime,Here on 9anime you can find all the latest and famous anime from Ga-Crew in HD Quality 1080. Watch and Download now,"Ga-Crew anime, Ga-Crew info, Ga-Crew download, Ga-Crew watch, 9anime, free anime online, watch anime",15,0,65,[],['Ga-Crew Studio Anime'],0,3,"['Login', 'Register', 'Browser', 'Genre', 'Random', 'FAQ', 'Option', '', 'Browse', 'Random', 'Genre', '', '', 'The Most Notorious ""Talker"" Runs the World\'s Greatest Clan', 'Episode 5']"
https://4anime.gg/studio/felix-film,3,Watch Felix Film anime online for Free on 9anime,Here on 9anime you can find all the latest and famous anime from Felix Film in HD Quality 1080. Watch and Download now,"Felix Film anime, Felix Film info, Felix Film download, Felix Film watch, 9anime, free anime online, watch anime",36,0,106,[],['Felix Film Studio Anime'],0,10,"['Login', 'Register', 'Browser', 'Genre', 'Random', 'FAQ', 'Option', '', 'Browse', 'Random', 'Genre', '', '', 'NekoparA', 'Episode 12', '', 'Aharen Is Indecipherable', 'Episode 12', '', 'Saving 80,000 Gold in Another World for My Retirement', 'Episode 12', '', 'MF Ghost', 'Episode 12', '', 'Otherside Picnic', 'Episode 12', '', 'You Are Ms. Servant.', 'Episode 4', '', 'MF Ghost 2nd Season', 'Episode 4', '', 'The Most Notorious ""Talker"" Runs the World\'s Greatest Clan', 'Episode 5']"
https://4anime.gg/yakuza-fiance-19336,2,Watch Yakuza Fiancé online free on 4anime,Watch Yakuza Fiancé in HD quality and download Yakuza Fiancé HD version for free - DUB and SUB available,"watch Yakuza Fiancé online free, Yakuza Fiancé download, free Yakuza Fiancé stream, Yakuza Fiancé DUB, Yakuza Fiancé SUB",17,0,315,"['Yakuza Fiancé', 'Yakuza Fiancé']",['Studio Deen'],0,3,"['Login', 'Register', 'Browser', 'Genre', 'Random', 'FAQ', 'Option', '', 'Browse', 'Random', 'Genre', '', 'Romance', 'Studio Deen', 'TV Series', 'Studio Deen', 'Romance']"
https://4anime.gg/studio/studio-deen,3,Watch Studio Deen anime online for Free on 9anime,Here on 9anime you can find all the latest and famous anime from Studio Deen in HD Quality 1080. Watch and Download now,"Studio Deen anime, Studio Deen info, Studio Deen download, Studio Deen watch, 9anime, free anime online, watch anime",118,0,269,[],['Studio Deen Studio Anime'],0,36,"['Login', 'Register', 'Browser', 'Genre', 'Random', 'FAQ', 'Option', '', 'Browse', 'Random', 'Genre', '', '', 'Ranma ½ OVA', 'Episode 6', '', 'Sakamoto Desu ga? Special', 'Episode 1', '', 'Jewelpet Magical Change', 'Episode 39', '', 'Showa Genroku Rakugo Shinju', 'Episode 13', '', 'Nurarihyon no Mago (Recaps)', 'Episode 2', '', 'Ranma ½: Yomigaeru Kioku', 'Episode 2', '', 'Kyou kara Maou! R', 'Episode 5', '', 'Ah My Buddha Katsu Special', 'Episode 1', '', 'Yamibo: Darkness, The Hat and the Travelers of the Books', 'Episode 13', '', 'Tomie', 'Episode 2', '', 'Sailor Moon Eternal: The Movie II', 'Episode 1', '', 'Is This a Zombie? OVA', 'Episode 1', '', 'Is This a Zombie? Of the Dead OVA', 'Episode 1', '', 'Sailor Moon Eternal: The Movie I', 'Episode 1', '', 'Samurai X: Trust and Betrayal', 'Episode 4', '', 'Samurai X: Reflection', 'Episode 2', '', 'Rurouni Kenshin: New Kyoto Arc', 'Episode 1', '', ""You're Under Arrest: Mini Specials"", 'Episode 5', '', ""You're Under Arrest: Diverting Traffic at the Beach"", 'Episode 1', '', ""You're Under Arrest: No Mercy!!"", 'Episode 1', '', 'Sankarea OVA', 'Episode 2', '', 'Sankarea: I, Too, Am... A Zombie...', 'Episode 1', '', 'R.O.D - Read or Die OVA', 'Episode 3', '', 'Hetalia World Series: Specials', 'Episode 4', '', 'Hetalia: The Beautiful World Specials', 'Episode 5', '', '07-Ghost', 'Episode 25', '', 'Ah My Buddha', 'Episode 13', '', 'Aooni The Blue Monster', 'Episode 13', '', 'Ah My Buddha Katsu', 'Episode 12', '', 'Amatsuki', 'Episode 13', '', 'Bakumatsu', 'Episode 12', '', 'Bakumatsu: Crisis', 'Episode 12', '', 'Bomberman Jetters', 'Episode 52', '', 'DNA²', 'Episode 12', '2', '3', '›', '»']"
https://4anime.gg/haigakura-19361,2,Watch Haigakura online free on 4anime,Watch Haigakura in HD quality and download Haigakura HD version for free - DUB and SUB available,"watch Haigakura online free, Haigakura download, free Haigakura stream, Haigakura DUB, Haigakura SUB",17,0,207,"['Haigakura', 'Haigakura']",['Typhoon Graphics'],0,3,"['Login', 'Register', 'Browser', 'Genre', 'Random', 'FAQ', 'Option', '', 'Browse', 'Random', 'Genre', '', 'Fantasy', 'Typhoon Graphics', 'TV Series', 'Typhoon Graphics', 'Fantasy']"
https://4anime.gg/studio/typhoon-graphics,3,Watch Typhoon Graphics anime online for Free on 9anime,Here on 9anime you can find all the latest and famous anime from Typhoon Graphics in HD Quality 1080. Watch and Download now,"Typhoon Graphics anime, Typhoon Graphics info, Typhoon Graphics download, Typhoon Graphics watch, 9anime, free anime online, watch anime",36,0,100,[],['Typhoon Graphics Studio Anime'],0,10,"['Login', 'Register', 'Browser', 'Genre', 'Random', 'FAQ', 'Option', '', 'Browse', 'Random', 'Genre', '', '', 'One Room', 'Episode 12', '', 'Room Mate', 'Episode 12', '', 'Sengoku Night Blood', 'Episode 12', '', 'Suddenly, Egyptian Gods Season 2', 'Episode 10', '', ""The Reason Why Raeliana Ended up at the Duke's Mansion"", 'Episode 12', '', 'Death Hall', 'Episode 1', '', 'Dahlia in Bloom', 'Episode 12', '', 'Haigakura', 'Episode 4']"
https://4anime.gg/nina-the-starry-bride-19348,2,Watch Nina the Starry Bride online free on 4anime,Watch Nina the Starry Bride in HD quality and download Nina the Starry Bride HD version for free - DUB and SUB available,"watch Nina the Starry Bride online free, Nina the Starry Bride download, free Nina the Starry Bride stream, Nina the Starry Bride DUB, Nina the Starry Bride SUB",19,0,186,"['Nina the Starry Bride', 'Nina the Starry Bride']",['Signal.MD'],0,3,"['Login', 'Register', 'Browser', 'Genre', 'Random', 'FAQ', 'Option', '', 'Browse', 'Random', 'Genre', '', 'Fantasy', 'Romance', 'Signal.MD', 'TV Series', 'Signal.MD', 'Fantasy', 'Romance']"
https://4anime.gg/studio/signalmd,3,Watch Signal.MD anime online for Free on 9anime,Here on 9anime you can find all the latest and famous anime from Signal.MD in HD Quality 1080. Watch and Download now,"Signal.MD anime, Signal.MD info, Signal.MD download, Signal.MD watch, 9anime, free anime online, watch anime",81,0,192,[],['Signal.MD Studio Anime'],0,25,"['Login', 'Register', 'Browser', 'Genre', 'Random', 'FAQ', 'Option', '', 'Browse', 'Random', 'Genre', '', '', 'Recovery of an MMO Junkie Special', 'Episode 1', '', 'FLCL Progressive', 'Episode 6', '', 'Atom: The Beginning', 'Episode 12', '', ""Dragon's House-Hunting"", 'Episode 12', '', 'Mars Red', 'Episode 13', '', 'Recovery of an MMO Junkie', 'Episode 10', '', 'Tantei Team KZ Jiken Note', 'Episode 16', '', 'Birthday Wonderland', 'Episode 1', '', 'Words Bubble Up Like Soda Pop', 'Episode 1', '', 'Fate/Grand Order: Shinsei Entaku Ryouiki Camelot 1 - Wandering; Agateram', 'Episode 1', '', 'Napping Princess', 'Episode 1', '', 'Kimi dake ni Motetainda.', 'Episode 1', '', 'The Orbital Children', 'Episode 6', '', 'Hitorigurashi no Shougakusei', 'Episode 10', '', ""I'm glad I could keep running."", 'Episode 4', '', 'The Fire Hunter', 'Episode 10', '', 'Kizuna no Allele', 'Episode 12', '', 'Colorful Ninja Iromaki', 'Episode 1', '', 'Kizuna no Allele Season 2', 'Episode 12', '', 'The Fire Hunter Season 2', 'Episode 10', '', 'Code Zero Daily Report', 'Episode 5', '', 'Shinkalion: Change the World', 'Episode 27', '', 'Nina the Starry Bride', 'Episode 4']"
https://4anime.gg/ron-kamonohashis-forbidden-deductions-season-2-19330,2,Watch Ron Kamonohashi's Forbidden Deductions Season 2 online free on 4anime,Watch Ron Kamonohashi's Forbidden Deductions Season 2 in HD quality and download Ron Kamonohashi's Forbidden Deductions Season 2 HD version for free - DUB and SUB available,"watch Ron Kamonohashi's Forbidden Deductions Season 2 online free, Ron Kamonohashi's Forbidden Deductions Season 2 download, free Ron Kamonohashi's Forbidden Deductions Season 2 stream, Ron Kamonohashi's Forbidden Deductions Season 2 DUB, Ron Kamonohashi's Forbidden Deductions Season 2 SUB",19,0,102,"[""Ron Kamonohashi's Forbidden Deductions Season 2"", ""Ron Kamonohashi's Forbidden Deductions Season 2""]",['Diomedea'],0,3,"['Login', 'Register', 'Browser', 'Genre', 'Random', 'FAQ', 'Option', '', 'Browse', 'Random', 'Genre', '', 'Comedy', 'Mystery', 'Diomedea', 'TV Series', 'Diomedea', 'Comedy', 'Mystery']"
https://4anime.gg/studio/diomedea,3,Watch Diomedea anime online for Free on 9anime,Here on 9anime you can find all the latest and famous anime from Diomedea in HD Quality 1080. Watch and Download now,"Diomedea anime, Diomedea info, Diomedea download, Diomedea watch, 9anime, free anime online, watch anime",116,0,270,[],['Diomedea Studio Anime'],0,36,"['Login', 'Register', 'Browser', 'Genre', 'Random', 'FAQ', 'Option', '', 'Browse', 'Random', 'Genre', '', '', 'Beatless Intermission', 'Episode 4', '', 'My Girlfriend Is ShoBitch', 'Episode 1', '', 'Akuma no Riddle: Shousha wa Dare? Nukiuchi Test', 'Episode 1', '', 'Kuusen Madoushi Kouhosei no Kyoukan: Lecty no, Ikimonogatari', 'Episode 1', '', ""Astarotte's Toy EX"", 'Episode 1', '', 'Action Heroine Cheer Fruits', 'Episode 12', '', 'Ahiru no Sora', 'Episode 50', '', 'AHO-GIRL', 'Episode 12', '', ""Astarotte's Toy"", 'Episode 12', '', 'Beatless', 'Episode 20', '', 'Beatless Final Stage', 'Episode 4', '', 'Campione!', 'Episode 13', '', ""Chio's School Road"", 'Episode 12', '', 'Cute High Earth Defense Club LOVE!', 'Episode 12', '', 'Domestic Girlfriend', 'Episode 12', '', 'Fuuka', 'Episode 12', '', 'Gingitsune: Messenger Fox of the Gods', 'Episode 12', '', 'Girlish Number', 'Episode 12', '', 'KanColle: Kantai Collection', 'Episode 12', '', ""Haruka Nogizaka's Secret"", 'Episode 12', '', 'Nogizaka Haruka no Himitsu: Purezza', 'Episode 12', '', ""Problem children are coming from another world, aren't they?"", 'Episode 10', '', 'Riddle Story of Devil', 'Episode 12', '', 'Handa-kun', 'Episode 12', '', 'Sky Wizards Academy', 'Episode 12', '', 'The Lost Village', 'Episode 12', '', 'The Squid Girl', 'Episode 12', '', 'The Squid Girl 2', 'Episode 12', '', 'Juuou Mujin no Fafnir', 'Episode 12', '', 'World Break: Aria of Curse for a Holy Swordsman', 'Episode 12', '', 'Domestic Girlfriend (Uncensored)', 'Episode 12', '', 'Fleet Girls Collection KanColle Movie Sequence', 'Episode 1', '', 'My Mental Choices Are Completely Interfering With My School Romantic Comedy', 'Episode 10', '', 'Ore no Nounai Sentakushi ga, Gakuen Love Comedy wo Zenryoku de Jama Shiteiru OVA', 'Episode 1', '2', '›']"
https://4anime.gg/love-live-superstar-3rd-season-19352,2,Watch Love Live! Superstar!! 3rd Season online free on 4anime,Watch Love Live! Superstar!! 3rd Season in HD quality and download Love Live! Superstar!! 3rd Season HD version for free - DUB and SUB available,"watch Love Live! Superstar!! 3rd Season online free, Love Live! Superstar!! 3rd Season download, free Love Live! Superstar!! 3rd Season stream, Love Live! Superstar!! 3rd Season DUB, Love Live! Superstar!! 3rd Season SUB",17,0,267,"['Love Live! Superstar!! 3rd Season', 'Love Live! Superstar!! 3rd Season']",['Sunrise'],0,3,"['Login', 'Register', 'Browser', 'Genre', 'Random', 'FAQ', 'Option', '', 'Browse', 'Random', 'Genre', '', 'Slice of Life', 'Sunrise', 'TV Series', 'Sunrise', 'Slice of Life']"
https://4anime.gg/studio/sunrise,3,Watch Sunrise anime online for Free on 9anime,Here on 9anime you can find all the latest and famous anime from Sunrise in HD Quality 1080. Watch and Download now,"Sunrise anime, Sunrise info, Sunrise download, Sunrise watch, 9anime, free anime online, watch anime",118,0,305,[],['Sunrise Studio Anime'],0,36,"['Login', 'Register', 'Browser', 'Genre', 'Random', 'FAQ', 'Option', '', 'Browse', 'Random', 'Genre', '', '', 'Colorful The Motion Picture', 'Episode 1', '', 'Mobile Suit Gundam Wing: Operation Meteor', 'Episode 4', '', 'Mobile Suit Gundam SEED Special Edition', 'Episode 3', '', 'Mobile Suit Gundam SEED Destiny Special Edition', 'Episode 4', '', 'Mobile Suit Gundam SEED C.E.73: Stargazer', 'Episode 1', '', 'My-Hime Specials', 'Episode 28', '', 'Mobile Suit Gundam MS IGLOO: Apocalypse 0079', 'Episode 3', '', 'Mobile Suit Gundam MS IGLOO 2: Gravity of the Battlefront', 'Episode 3', '', 'Mobile Suit Gundam MS IGLOO: The Hidden One Year War', 'Episode 3', '', 'Mobile Suit Gundam Unicorn: Episode EX - 100 Years of Solitude', 'Episode 1', '', 'Mokei Senshi Gunpla Builders Beginning G', 'Episode 1', '', 'Mobile Suit Gundam AGE: Memory of Eden', 'Episode 2', '', 'Gundam Build Divers Prologue', 'Episode 1', '', 'Mobile Suit Gundam SEED MSV Astray', 'Episode 2', '', 'Chou Deneiban SD Gundam Sangokuden Brave Battle Warriors', 'Episode 1', '', 'Gintama Season 2', 'Episode 51', '', '[RAW] Chouja Raideen', 'Episode 38', '', '[RAW] Kagaku Bouken-tai Tansar 5', 'Episode 34', '', 'Gintama: Enchousen', 'Episode 13', '', 'Mobile Suit Gundam 00 Special Edition', 'Episode 3', '', 'Ranma ½ Super', 'Episode 3', '', 'InuYasha: The Final Act', 'Episode 26', '', 'Gintama Movie 2: The Final Chapter - Be Forever Yorozuya', 'Episode 1', '', 'Argento Soma Special', 'Episode 1', '', 'Love Live! School Idol Project', 'Episode 13', '', 'Buddy Complex: Kanketsu-hen - Ano Sora ni Kaeru Mirai de', 'Episode 2', '', 'Natsu-iro Kiseki: 15-kaime no Natsuyasumi', 'Episode 1', '', 'The Brave of Gold Goldran', 'Episode 48', '', 'Accel World', 'Episode 24', '', 'After War Gundam X', 'Episode 39', '', 'Aikatsu!', 'Episode 178', '', 'Armored Trooper Votoms', 'Episode 52', '', 'Argento Soma', 'Episode 25', '', 'Angel Links', 'Episode 13', '2', '3', '›', '»']"
https://4anime.gg/punirunes-2-19381,2,Watch Punirunes 2 online free on 4anime,Watch Punirunes 2 in HD quality and download Punirunes 2 HD version for free - DUB and SUB available,"watch Punirunes 2 online free, Punirunes 2 download, free Punirunes 2 stream, Punirunes 2 DUB, Punirunes 2 SUB",19,0,92,"['Punirunes 2', 'Punirunes 2']",['OLM Digital'],0,3,"['Login', 'Register', 'Browser', 'Genre', 'Random', 'FAQ', 'Option', '', 'Browse', 'Random', 'Genre', '', 'Fantasy', 'Slice of Life', 'OLM Digital', 'TV Series', 'OLM Digital', 'Fantasy', 'Slice of Life']"
https://4anime.gg/studio/olm-digital,3,Watch OLM Digital anime online for Free on 9anime,Here on 9anime you can find all the latest and famous anime from OLM Digital in HD Quality 1080. Watch and Download now,"OLM Digital anime, OLM Digital info, OLM Digital download, OLM Digital watch, 9anime, free anime online, watch anime",27,0,78,[],['OLM Digital Studio Anime'],0,7,"['Login', 'Register', 'Browser', 'Genre', 'Random', 'FAQ', 'Option', '', 'Browse', 'Random', 'Genre', '', '', 'Blade of the Phantom Master', 'Episode 1', '', 'Punirunes', 'Episode 25', '', 'Elysium', 'Episode', '', 'Rudolf the Black Cat', 'Episode 1', '', 'Punirunes 2', 'Episode 4']"
https://4anime.gg/battle-through-the-heavens-5th-season-18119,2,Watch Battle Through The Heavens 5th Season online free on 4anime,Watch Battle Through The Heavens 5th Season in HD quality and download Battle Through The Heavens 5th Season HD version for free - DUB and SUB available,"watch Battle Through The Heavens 5th Season online free, Battle Through The Heavens 5th Season download, free Battle Through The Heavens 5th Season stream, Battle Through The Heavens 5th Season DUB, Battle Through The Heavens 5th Season SUB",21,0,178,"['Battle Through The Heavens 5th Season', 'Battle Through The Heavens 5th Season']",['Motion Magic'],0,3,"['Login', 'Register', 'Browser', 'Genre', 'Random', 'FAQ', 'Option', '', 'Browse', 'Random', 'Genre', '', 'Action', 'Adventure', 'Fantasy', 'Motion Magic', 'ONA', 'Motion Magic', 'Action', 'Adventure', 'Fantasy']"
https://4anime.gg/studio/motion-magic,3,Watch Motion Magic anime online for Free on 9anime,Here on 9anime you can find all the latest and famous anime from Motion Magic in HD Quality 1080. Watch and Download now,"Motion Magic anime, Motion Magic info, Motion Magic download, Motion Magic watch, 9anime, free anime online, watch anime",24,0,82,[],['Motion Magic Studio Anime'],0,6,"['Login', 'Register', 'Browser', 'Genre', 'Random', 'FAQ', 'Option', '', 'Browse', 'Random', 'Genre', '', '', 'The Great Ruler', 'Episode 52', '', 'Dragon Prince Yuan', 'Episode 6', '', 'Fights Break Sphere: Three Year Agreement', 'Episode 13', '', 'Battle Through The Heavens 5th Season', 'Episode 118']"
https://4anime.gg/touhai-ura-rate-mahjong-touhai-roku-19358,2,Watch Touhai: Ura Rate Mahjong Touhai Roku online free on 4anime,Watch Touhai: Ura Rate Mahjong Touhai Roku in HD quality and download Touhai: Ura Rate Mahjong Touhai Roku HD version for free - DUB and SUB available,"watch Touhai: Ura Rate Mahjong Touhai Roku online free, Touhai: Ura Rate Mahjong Touhai Roku download, free Touhai: Ura Rate Mahjong Touhai Roku stream, Touhai: Ura Rate Mahjong Touhai Roku DUB, Touhai: Ura Rate Mahjong Touhai Roku SUB",19,0,198,"['Touhai: Ura Rate Mahjong Touhai Roku', 'Touhai: Ura Rate Mahjong Touhai Roku']",['East Fish Studio'],0,3,"['Login', 'Register', 'Browser', 'Genre', 'Random', 'FAQ', 'Option', '', 'Browse', 'Random', 'Genre', '', 'Drama', 'Thriller', 'East Fish Studio', 'TV Series', 'East Fish Studio', 'Drama', 'Thriller']"
https://4anime.gg/studio/east-fish-studio,3,Watch East Fish Studio anime online for Free on 9anime,Here on 9anime you can find all the latest and famous anime from East Fish Studio in HD Quality 1080. Watch and Download now,"East Fish Studio anime, East Fish Studio info, East Fish Studio download, East Fish Studio watch, 9anime, free anime online, watch anime",21,0,78,[],['East Fish Studio Studio Anime'],0,5,"['Login', 'Register', 'Browser', 'Genre', 'Random', 'FAQ', 'Option', '', 'Browse', 'Random', 'Genre', '', '', 'Mirage Queen Aime Cirque', 'Episode 1', '', 'A Condition Called Love', 'Episode 12', '', 'Touhai: Ura Rate Mahjong Touhai Roku', 'Episode 4']"
https://4anime.gg/puniru-is-a-kawaii-slime-19372,2,Watch Puniru is a Kawaii Slime online free on 4anime,Watch Puniru is a Kawaii Slime in HD quality and download Puniru is a Kawaii Slime HD version for free - DUB and SUB available,"watch Puniru is a Kawaii Slime online free, Puniru is a Kawaii Slime download, free Puniru is a Kawaii Slime stream, Puniru is a Kawaii Slime DUB, Puniru is a Kawaii Slime SUB",19,0,227,"['Puniru is a Kawaii Slime', 'Puniru is a Kawaii Slime']",['TOHO animation STUDIO'],0,3,"['Login', 'Register', 'Browser', 'Genre', 'Random', 'FAQ', 'Option', '', 'Browse', 'Random', 'Genre', '', 'Comedy', 'Romance', 'TOHO animation STUDIO', 'TV Series', 'TOHO animation STUDIO', 'Comedy', 'Romance']"
https://4anime.gg/studio/toho-animation-studio,3,Watch TOHO animation STUDIO anime online for Free on 9anime,Here on 9anime you can find all the latest and famous anime from TOHO animation STUDIO in HD Quality 1080. Watch and Download now,"TOHO animation STUDIO anime, TOHO animation STUDIO info, TOHO animation STUDIO download, TOHO animation STUDIO watch, 9anime, free anime online, watch anime",18,0,76,[],['TOHO animation STUDIO Studio Anime'],0,4,"['Login', 'Register', 'Browser', 'Genre', 'Random', 'FAQ', 'Option', '', 'Browse', 'Random', 'Genre', '', '', 'Sousou no Frieren - Marumaru no Mahou (Mini Anime)', 'Episode 12', '', 'Puniru is a Kawaii Slime', 'Episode 4']"
https://4anime.gg/mf-ghost-2nd-season-19344,2,Watch MF Ghost 2nd Season online free on 4anime,Watch MF Ghost 2nd Season in HD quality and download MF Ghost 2nd Season HD version for free - DUB and SUB available,"watch MF Ghost 2nd Season online free, MF Ghost 2nd Season download, free MF Ghost 2nd Season stream, MF Ghost 2nd Season DUB, MF Ghost 2nd Season SUB",15,0,93,"['MF Ghost 2nd Season', 'MF Ghost 2nd Season']",['Felix Film'],0,3,"['Login', 'Register', 'Browser', 'Genre', 'Random', 'FAQ', 'Option', '', 'Browse', 'Random', 'Genre', '', 'Felix Film', 'TV Series', 'Felix Film']"
https://4anime.gg/let-this-grieving-soul-retire-19356,2,Watch Let This Grieving Soul Retire online free on 4anime,Watch Let This Grieving Soul Retire in HD quality and download Let This Grieving Soul Retire HD version for free - DUB and SUB available,"watch Let This Grieving Soul Retire online free, Let This Grieving Soul Retire download, free Let This Grieving Soul Retire stream, Let This Grieving Soul Retire DUB, Let This Grieving Soul Retire SUB",21,0,200,"['Let This Grieving Soul Retire', 'Let This Grieving Soul Retire']",['Zero-G'],0,3,"['Login', 'Register', 'Browser', 'Genre', 'Random', 'FAQ', 'Option', '', 'Browse', 'Random', 'Genre', '', 'Action', 'Adventure', 'Fantasy', 'Zero-G', 'TV Series', 'Zero-G', 'Action', 'Adventure', 'Fantasy']"
https://4anime.gg/studio/zero-g,3,Watch Zero-G anime online for Free on 9anime,Here on 9anime you can find all the latest and famous anime from Zero-G in HD Quality 1080. Watch and Download now,"Zero-G anime, Zero-G info, Zero-G download, Zero-G watch, 9anime, free anime online, watch anime",75,0,198,[],['Zero-G Studio Anime'],0,23,"['Login', 'Register', 'Browser', 'Genre', 'Random', 'FAQ', 'Option', '', 'Browse', 'Random', 'Genre', '', '', 'Dorei-ku The Animation', 'Episode 12', '', 'Grand Blue Dreaming', 'Episode 12', '', 'Libra of Nil Admirari', 'Episode 12', '', 'My Roommate is a Cat', 'Episode 12', '', 'One Room Second Season', 'Episode 12', '', 'One Room Third Season', 'Episode 12', '', 'Piacevole: My Italian Cooking', 'Episode 12', '', 'Science Fell in Love, So I Tried to Prove It', 'Episode 12', '', 'Tsugumomo', 'Episode 12', '', 'The Night Beyond the Tricornered Window', 'Episode 12', '', 'DIVE!!', 'Episode 12', '', 'The House Spirit Tatami-chan', 'Episode 12', '', 'THE IDOLM@STER SideM Wakeatte Mini!', 'Episode 12', '', 'So I Tried to Prove It 2nd Season', 'Episode 12', '', 'The Ice Guy and His Cool Female Colleague', 'Episode 12', '', 'Farming Life in Another World', 'Episode 12', '', 'Tsugu Tsugumomo', 'Episode 12', '', 'One Room Second Season Special', 'Episode 1', '', ""I'm Giving the Disgraced Noble Lady I Rescued a Crash Course in Naughtiness"", 'Episode 12', '', 'Mysterious Disappearances', 'Episode 12', '', 'Let This Grieving Soul Retire', 'Episode 5']"
https://4anime.gg/tower-of-god-season-2-workshop-battle-19400,2,Watch Tower of God Season 2: Workshop Battle online free on 4anime,Watch Tower of God Season 2: Workshop Battle in HD quality and download Tower of God Season 2: Workshop Battle HD version for free - DUB and SUB available,"watch Tower of God Season 2: Workshop Battle online free, Tower of God Season 2: Workshop Battle download, free Tower of God Season 2: Workshop Battle stream, Tower of God Season 2: Workshop Battle DUB, Tower of God Season 2: Workshop Battle SUB",25,0,117,"['Tower of God Season 2: Workshop Battle', 'Tower of God Season 2: Workshop Battle']",['The Answer Studio'],0,3,"['Login', 'Register', 'Browser', 'Genre', 'Random', 'FAQ', 'Option', '', 'Browse', 'Random', 'Genre', '', 'Action', 'Adventure', 'Mystery', 'Drama', 'Fantasy', 'The Answer Studio', 'TV Series', 'The Answer Studio', 'Action', 'Adventure', 'Mystery', 'Drama', 'Fantasy']"
https://4anime.gg/studio/the-answer-studio,3,Watch The Answer Studio anime online for Free on 9anime,Here on 9anime you can find all the latest and famous anime from The Answer Studio in HD Quality 1080. Watch and Download now,"The Answer Studio anime, The Answer Studio info, The Answer Studio download, The Answer Studio watch, 9anime, free anime online, watch anime",27,0,88,[],['The Answer Studio Studio Anime'],0,7,"['Login', 'Register', 'Browser', 'Genre', 'Random', 'FAQ', 'Option', '', 'Browse', 'Random', 'Genre', '', '', 'Armored Trooper Votoms: Pailsen Files', 'Episode 12', '', 'Flag', 'Episode 13', '', 'Golgo 13', 'Episode 50', '', 'Tower of God Season 2', 'Episode 14', '', 'Tower of God Season 2: Workshop Battle', 'Episode 4']"
