url,depth,title,meta_description,meta_keywords,internal_link_count,external_link_count,word_count,h1_tags,h2_tags,main_word_count,image_count,link_texts
https://4anime.gg/home,0,4anime Official: Free anime to watch in HD quality,Watch online anime in HD Quality and download your favorite anime from 4anime.to official website.,"4anime, 4 anime, 4animeto, latest anime, watch anime online, free anime, anime free, online anime, anime website",114,0,308,[],"['Recently Updated', 'Recently Added', 'Upcoming']",0,39,"['Login', 'Register', 'Browser', 'Genre', 'Random', 'FAQ', 'Option', '', 'Browse', 'Random', 'Genre', '', 'Recently Updated', '', 'Himitsu no AiPri', 'Episode 30', '', 'KamiErabi GOD.app Season 2', 'Episode 5', '', ""Delico's Nursery"", 'Episode 9', '', 'True Beauty', 'Episode 13', '', 'The Prince of Tennis: U-17 World Cup Semifinal', 'Episode 5', '', 'Sengoku Youko', 'Episode 14', '', 'Re:ZERO -Starting Life in Another World- Season 3', 'Episode 5', '', 'The Do-Over Damsel Conquers The Dragon Emperor', 'Episode 4', '', 'Acro Trip', 'Episode 6', '', 'Murai in Love', 'Episode 9', '', 'A Herbivorous Dragon of 5,000 Years Gets Unfairly Villainized 2nd Season', 'Episode 6', '', 'Beyblade X', 'Episode 53', '', 'Tasuketsu -Fate of the Majority-', 'Episode 16', '', 'Tying the Knot with an Amagami Sister', 'Episode 5', '', 'I’ll Become a Villainess Who Goes Down in History', 'Episode 5', 'Recently Added', '', 'The 100 Girlfriends Who Really, Really, Really, Really, Really Love You', 'Episode 12', '', ""Jellyfish Can't Swim in the Night"", 'Episode 12', '', 'Level 1 Demon Lord and One Room Hero', 'Episode 12', '', 'After-School Hanako-kun Part 2', 'Episode 4', '', 'Mission: Yozakura Family', 'Episode 27', '', 'The Elusive Samurai', 'Episode 12', '', 'Attacker You!', 'Episode 54', '', 'My Hero Academia Season 7', 'Episode 21', '', 'Fight Da!! Pyuta', 'Episode 10', '', 'Cardfight!! Vanguard: Divinez Season 2', 'Episode 13', 'Upcoming', '', 'One Piece Log: Fish-Man Island Saga', '', 'Murder Mystery of the Dead', '', 'Kagaku x Bouken Survival!', '', 'Genjitsu no Yohane: Sunshine in the Mirror Movie', '', 'Give It All', '', 'Solo Leveling: ReAwakening', '', 'Attack on Titan: The Last Attack', '', 'Gintama on Theater 2D: Kintama-hen', '', 'Beastars Final Season', '', 'Pinkfong-gwa Hogi: Sae Chingu Ninimo', '', 'Pochaazu', '', 'Kumarba Season 2']"
https://4anime.gg/login,1,4anime - Watch Anime online free with English DUB and SUB,Free anime website with real 1080 HD quality with English subtitle - Just sit back and relax!,"4anime, 4 anime, 4animeto, watch anime online, free anime, anime free, online anime, anime website",2,0,23,[],[],0,0,"['Back to home', ""Don't have an account?""]"
https://4anime.gg/,2,4anime - Watch Anime online free with English DUB and SUB,Free anime website with real 1080 HD quality with English subtitle - Just sit back and relax!,"4anime, 4 anime, 4animeto, watch anime online, free anime, anime free, online anime, anime website",13,0,827,['4Anime - Watch Anime Online Free'],"['Free to Watch Anime Online', 'Anything Wrong with 4anime?', 'Why 4anime.to is not accessible, Is 4anime shutdown?', 'The Best Place to Watch Anime for Free is 4anime?', 'Is it Illegal to Use 4anime?', 'Does 4anime Have a New Website?']",0,3,"['Login', 'Register', 'Browser', 'Genre', 'Random', 'FAQ', 'Option', '', 'Browse', 'Random', 'Genre', '', 'VIEW FULL SITE']"
https://4anime.gg/register,3,4anime - Watch Anime online free with English DUB and SUB,Free anime website with real 1080 HD quality with English subtitle - Just sit back and relax!,"4anime, 4 anime, 4animeto, watch anime online, free anime, anime free, online anime, anime website",2,0,26,[],[],0,0,"['Back to home', 'Already have an account?']"
https://4anime.gg/browse,3,4anime - Watch Anime online free with English DUB and SUB,Free anime website with real 1080 HD quality with English subtitle - Just sit back and relax!,"4anime, 4 anime, 4animeto, watch anime online, free anime, anime free, online anime, anime website",121,0,416,[],['Browse'],0,37,"['Login', 'Register', 'Browser', 'Genre', 'Random', 'FAQ', 'Option', '', 'Browse', 'Random', 'Genre', '', '', 'Rick and Morty: The Anime', 'Episode 10', '', 'NieR:Automata Ver1.1a: Specials', 'Episode 1', '', 'Back to the Great Ming', 'Episode 16', '', ""The Sovereign's Ascension"", 'Episode 45', '', 'The Legend of Magic Outfit', 'Episode 31', '', 'Rising Impact Season 2', 'Episode 14', '', 'Immortality 4th Season', 'Episode 13', '', 'The Girl Downstairs Extra', 'Episode 1', '', 'A Moment but Forever', 'Episode 4', '', 'Sword of Coming', 'Episode 13', '', 'Tomb of Fallen Gods', 'Episode 1', '', 'Fabulous Beasts 4th Season', 'Episode 3', '', 'Spy x Family Code: White', 'Episode 1', '', 'The Metaverse', 'Episode 16', '', 'Supreme Sword God', 'Episode 20', '', 'The Young Imperial Guards 2nd Season Prologue', 'Episode 1', '', 'The Young Imperial Guards Prologue', 'Episode 1', '', 'Hyperventilation Special', 'Episode 1', '', '4 Week Lovers', 'Episode 10', '', 'Semantic Error', 'Episode 4', '', 'Long Sword, Wind and Cloud 2nd Season', 'Episode 10', '', ""The Young Brewmaster's Adventure"", 'Episode 20', '', 'Sengoku Youko - Recap', 'Episode 2', '', 'Tales Of Dark River Part 2', 'Episode 14', '', 'Tales Of Dark River', 'Episode 12', '', 'Glorious Revenge of Ye Feng', 'Episode 40', '', 'The Proud Emperor of Eternity', 'Episode 20', '', 'Great Doctor Miss Nine 2nd Season', 'Episode 20', '', 'Winter Present', 'Episode 1', '', 'Whimsical Wish', 'Episode 8', '', 'The Demon Hunter: Dongning Mansion Special', 'Episode 4', '', 'Roommates', 'Episode 10', '', 'My Heroic Husband 2nd Season', 'Episode 15', '', 'Time-Patrol Bon 2nd Season', 'Episode 12', '', ""New Qin's Moon"", 'Episode 39', '2', '3', '›', '»']"
https://4anime.gg/genre,3,4anime - Watch Anime online free with English DUB and SUB,Free anime website with real 1080 HD quality with English subtitle - Just sit back and relax!,"4anime, 4 anime, 4animeto, watch anime online, free anime, anime free, online anime, anime website",121,0,317,[],['Genre'],0,37,"['Login', 'Register', 'Browser', 'Genre', 'Random', 'FAQ', 'Option', '', 'Browse', 'Random', 'Genre', '', '', 'Rick and Morty: The Anime', 'Episode 10', '', 'NieR:Automata Ver1.1a: Specials', 'Episode 1', '', 'Back to the Great Ming', 'Episode 16', '', ""The Sovereign's Ascension"", 'Episode 45', '', 'The Legend of Magic Outfit', 'Episode 31', '', 'Rising Impact Season 2', 'Episode 14', '', 'Immortality 4th Season', 'Episode 13', '', 'The Girl Downstairs Extra', 'Episode 1', '', 'A Moment but Forever', 'Episode 4', '', 'Sword of Coming', 'Episode 13', '', 'Tomb of Fallen Gods', 'Episode 1', '', 'Fabulous Beasts 4th Season', 'Episode 3', '', 'Spy x Family Code: White', 'Episode 1', '', 'The Metaverse', 'Episode 16', '', 'Supreme Sword God', 'Episode 20', '', 'The Young Imperial Guards 2nd Season Prologue', 'Episode 1', '', 'The Young Imperial Guards Prologue', 'Episode 1', '', 'Hyperventilation Special', 'Episode 1', '', '4 Week Lovers', 'Episode 10', '', 'Semantic Error', 'Episode 4', '', 'Long Sword, Wind and Cloud 2nd Season', 'Episode 10', '', ""The Young Brewmaster's Adventure"", 'Episode 20', '', 'Sengoku Youko - Recap', 'Episode 2', '', 'Tales Of Dark River Part 2', 'Episode 14', '', 'Tales Of Dark River', 'Episode 12', '', 'Glorious Revenge of Ye Feng', 'Episode 40', '', 'The Proud Emperor of Eternity', 'Episode 20', '', 'Great Doctor Miss Nine 2nd Season', 'Episode 20', '', 'Winter Present', 'Episode 1', '', 'Whimsical Wish', 'Episode 8', '', 'The Demon Hunter: Dongning Mansion Special', 'Episode 4', '', 'Roommates', 'Episode 10', '', 'My Heroic Husband 2nd Season', 'Episode 15', '', 'Time-Patrol Bon 2nd Season', 'Episode 12', '', ""New Qin's Moon"", 'Episode 39', '2', '3', '›', '»']"
https://4anime.gg/random,3,Watch Raiyantsuuri no Uta online free on 4anime,Watch Raiyantsuuri no Uta in HD quality and download Raiyantsuuri no Uta HD version for free - DUB and SUB available,"watch Raiyantsuuri no Uta online free, Raiyantsuuri no Uta download, free Raiyantsuuri no Uta stream, Raiyantsuuri no Uta DUB, Raiyantsuuri no Uta SUB",17,0,134,"['Raiyantsuuri no Uta', 'Raiyantsuuri no Uta']",[''],0,3,"['Login', 'Register', 'Browser', 'Genre', 'Random', 'FAQ', 'Option', '', 'Browse', 'Random', 'Genre', '', 'Drama', 'Historical', 'Movie', 'Drama', 'Historical']"
https://4anime.gg/recently-updated,1,4anime - Watch Anime online free with English DUB and SUB,Free anime website with real 1080 HD quality with English subtitle - Just sit back and relax!,"4anime, 4 anime, 4animeto, watch anime online, free anime, anime free, online anime, anime website",136,0,339,[],['Recently Updated'],0,42,"['Login', 'Register', 'Browser', 'Genre', 'Random', 'FAQ', 'Option', '', 'Browse', 'Random', 'Genre', '', '', 'Himitsu no AiPri', 'Episode 30', '', 'KamiErabi GOD.app Season 2', 'Episode 5', '', ""Delico's Nursery"", 'Episode 9', '', 'True Beauty', 'Episode 13', '', 'The Prince of Tennis: U-17 World Cup Semifinal', 'Episode 5', '', 'Sengoku Youko', 'Episode 14', '', 'Re:ZERO -Starting Life in Another World- Season 3', 'Episode 5', '', 'The Do-Over Damsel Conquers The Dragon Emperor', 'Episode 4', '', 'Acro Trip', 'Episode 6', '', 'Murai in Love', 'Episode 9', '', 'A Herbivorous Dragon of 5,000 Years Gets Unfairly Villainized 2nd Season', 'Episode 6', '', 'Beyblade X', 'Episode 53', '', 'Tasuketsu -Fate of the Majority-', 'Episode 16', '', 'Tying the Knot with an Amagami Sister', 'Episode 5', '', 'I’ll Become a Villainess Who Goes Down in History', 'Episode 5', '', 'A Terrified Teacher at Ghoul School', 'Episode 4', '', 'My Heroic Husband 2nd Season', 'Episode 15', '', 'Swallowed Star 2nd Season', 'Episode 113', '', 'After-School Hanako-kun Part 2', 'Episode 4', '', 'Seirei Gensouki: Spirit Chronicles Season 2', 'Episode 4', '', ""Natsume's Book of Friends Season 7"", 'Episode 4', '', ""Arifureta: From Commonplace to World's Strongest Season 3"", 'Episode 3', '', 'The Most Notorious ""Talker"" Runs the World\'s Greatest Clan', 'Episode 5', '', 'Yakuza Fiancé', 'Episode 4', '', 'Haigakura', 'Episode 4', '', 'Nina the Starry Bride', 'Episode 4', '', ""Ron Kamonohashi's Forbidden Deductions Season 2"", 'Episode 4', '', 'Love Live! Superstar!! 3rd Season', 'Episode 4', '', 'Punirunes 2', 'Episode 4', '', 'Battle Through The Heavens 5th Season', 'Episode 118', '', 'Touhai: Ura Rate Mahjong Touhai Roku', 'Episode 4', '', 'Puniru is a Kawaii Slime', 'Episode 4', '', 'MF Ghost 2nd Season', 'Episode 4', '', 'Let This Grieving Soul Retire', 'Episode 5', '', 'Tower of God Season 2: Workshop Battle', 'Episode 4', '', 'If My Wife Becomes an Elementary School Student.', 'Episode 5', '', 'Fairy Tail: 100 Years Quest', 'Episode 16', '', 'Shangri-La Frontier Season 2', 'Episode 3', '', ""Don't Give Up!"", 'Episode 19', '', 'Attacker You!', 'Episode 54', '2', '3', '›', '»']"
https://4anime.gg/himitsu-no-aipri-19096,2,Watch Himitsu no AiPri online free on 4anime,Watch Himitsu no AiPri in HD quality and download Himitsu no AiPri HD version for free - DUB and SUB available,"watch Himitsu no AiPri online free, Himitsu no AiPri download, free Himitsu no AiPri stream, Himitsu no AiPri DUB, Himitsu no AiPri SUB",21,0,161,"['Himitsu no AiPri', 'Himitsu no AiPri']","['OLM,Dongwoo A&E']",0,3,"['Login', 'Register', 'Browser', 'Genre', 'Random', 'FAQ', 'Option', '', 'Browse', 'Random', 'Genre', '', 'Game', 'Music', 'OLM', 'Dongwoo A&E', 'TV Series', 'OLM', 'Dongwoo A&E', 'Game', 'Music']"
https://4anime.gg/genre/game,3,Watch Game Anime Online Free,Free Game Anime Streaming with both Subbed and Dubbed. Download Game anime online FREE from Zoro.to website.,"watch Game anime, free Game anime, download Game anime, latest Game anime, dubbed Game anime, subbed Game anime, most watched Game anime",121,0,274,[],['Genre Game'],0,37,"['Login', 'Register', 'Browser', 'Genre', 'Random', 'FAQ', 'Option', '', 'Browse', 'Random', 'Genre', '', '', 'Recovery of an MMO Junkie Special', 'Episode 1', '', 'Shadowverse (TV) Recaps', 'Episode 2', '', 'WIXOSS Diva(A)Live', 'Episode 12', '', '[RAW] Duel Masters Zero', 'Episode 23', '', 'Naruto Narutimate Hero 3: Tsuini Gekitotsu! Jounin vs. Genin!! Musabetsu Dairansen Taikai Kaisai!!', 'Episode 1', '', 'D-Frag!', 'Episode 12', '', 'High Score Girl: Extra Stage', 'Episode 3', '', ""The King's Avatar (2018)"", 'Episode 3', '', 'Rio: Rainbow Gate! Special', 'Episode 1', '', '.hack//Unison', 'Episode 1', '', '.hack//Intermezzo', 'Episode 1', '', 'Puzzle & Dragons X', 'Episode 89', '', 'The New Prince of Tennis: Hyoutei vs. Rikkai - Game of Future', 'Episode 2', '', '[RAW] Idaten Jump', 'Episode 52', '', 'Pokemon Movie 23: Coco', 'Episode 1', '', '.hack//Legend Of The Twilight', 'Episode 12', '', '.hack//Quantum', 'Episode 3', '', 'Accel World', 'Episode 24', '', 'Touhai Densetsu Akagi: Yami ni Maiorita Tensai', 'Episode 26', '', '.hack//roots', 'Episode 26', '', '.hack//Sign', 'Episode 26', '', '.hack//Liminality', 'Episode 4', '', 'After School Dice Club', 'Episode 12', '', 'And you thought there is never a girl online?', 'Episode 12', '', ""BOFURI: I Don't Want to Get Hurt, so I'll Max Out My Defense."", 'Episode 12', '', 'Battle Spirits: Kakumei no Galette', 'Episode 5', '', 'Battle Spirits: Heroes', 'Episode 50', '', 'Battle Spirits: Brave', 'Episode 50', '', 'Battle Spirits: Shounen Gekiha Dan', 'Episode 50', '', 'Battle Spirits: Sword Eyes', 'Episode 29', '', 'Battle Spirits: Sword Eyes Gekitouden', 'Episode 21', '', 'Beryl and Sapphire', 'Episode 72', '', 'Bakugan: Battle Planet', 'Episode 50', '', 'Bakugan Battle Brawlers', 'Episode 52', '', 'Bakugan Battle Brawlers: Gundalian Invaders', 'Episode 39', '2', '3', '›', '»']"
https://4anime.gg/genre/music,3,Watch Music Anime Online Free,Free Music Anime Streaming with both Subbed and Dubbed. Download Music anime online FREE from Zoro.to website.,"watch Music anime, free Music anime, download Music anime, latest Music anime, dubbed Music anime, subbed Music anime, most watched Music anime",121,0,239,[],['Genre Music'],0,37,"['Login', 'Register', 'Browser', 'Genre', 'Random', 'FAQ', 'Option', '', 'Browse', 'Random', 'Genre', '', '', 'Ensemble Stars! Recap Special', 'Episode 1', '', 'I★Chu: Étoile Stage', 'Episode 12', '', 'Idoly Pride', 'Episode 12', '', 'Sound of the Sky', 'Episode 1', '', 'K-On!: Live House!', 'Episode 1', '', 'K-On!!: Keikaku!', 'Episode 1', '', 'Uta no☆Prince-sama♪ Maji Love 2000%: Shining Star Xmas', 'Episode 1', '', 'Nana: Special Recaps', 'Episode 3', '', 'Love Live! School Idol Project', 'Episode 13', '', 'Aikatsu Planet!', 'Episode 25', '', 'Sound! Euphonium Specials', 'Episode 7', '', 'Sound! Euphonium 2 Specials', 'Episode 7', '', 'IDOLiSH7 Vibrato', 'Episode 8', '', 'The World God Only Knows: Four Girls and an Idol', 'Episode 1', '', 'Macross 7 Encore', 'Episode 3', '', 'Escha Chron', 'Episode 2', '', '22/7', 'Episode 12', '', 'Aikatsu Friends!', 'Episode 50', '', 'Aikatsu Friends!: Kagayaki no Jewel', 'Episode 26', '', 'Aikatsu on Parade!', 'Episode 25', '', 'Aikatsu on Parade! (ONA)', 'Episode 3', '', 'Aikatsu Stars!', 'Episode 100', '', 'Aikatsu!', 'Episode 178', '', ""Angel's 3Piece!"", 'Episode 12', '', 'ARP Backstage Pass', 'Episode 11', '', 'B-Project: Kodou*Ambitious', 'Episode 12', '', 'B-Project: Zecchou*Emotion', 'Episode 12', '', 'BanG Dream!', 'Episode 13', '', 'BanG Dream! 2nd Season', 'Episode 13', '', 'Beck: Mongolian Chop Squad', 'Episode 26', '', 'BanG Dream! 3rd Season', 'Episode 13', '', 'BanG Dream! Garupa☆Pico: Oomori', 'Episode 26', '', 'BanG Dream! Garupa☆Pico', 'Episode 26', '', 'Carole & Tuesday', 'Episode 24', '', 'IDOLiSH7: Second Beat!', 'Episode 15', '2', '3', '›', '»']"
https://4anime.gg/studio/olm,3,Watch OLM anime online for Free on 9anime,Here on 9anime you can find all the latest and famous anime from OLM in HD Quality 1080. Watch and Download now,"OLM anime, OLM info, OLM download, OLM watch, 9anime, free anime online, watch anime",118,0,244,[],['OLM Studio Anime'],0,36,"['Login', 'Register', 'Browser', 'Genre', 'Random', 'FAQ', 'Option', '', 'Browse', 'Random', 'Genre', '', '', '[RAW] Mojakou', 'Episode 74', '', 'Pokémon: Black & White', 'Episode 48', '', 'Pokémon: Black & White: Rival Destinies', 'Episode 49', '', 'Pokémon: Black & White: Adventures in Unova', 'Episode 45', '', 'Pokémon the Series: XYZ', 'Episode 48', '', 'Utawarerumono Specials', 'Episode 4', '', '[RAW] Zoids Wild Zero', 'Episode 50', '', 'Pokemon Movie 23: Coco', 'Episode 1', '', '100% Teacher Pascal', 'Episode 36', '', 'Atom: The Beginning', 'Episode 12', '', 'Age 12.', 'Episode 12', '', 'Age 12.: 2nd Season', 'Episode 12', '', 'Berserk (1997)', 'Episode 25', '', 'Beyblade Burst Gachi', 'Episode 52', '', 'Bungo and Alchemist -Gears of Judgement-', 'Episode 13', '', 'Beyblade Burst', 'Episode 51', '', 'Beyblade Burst Turbo', 'Episode 51', '', 'Cardfight!! Vanguard G NEXT', 'Episode 52', '', 'Cardfight!! Vanguard G Z', 'Episode 24', '', 'Dragon Collection', 'Episode 51', '', 'Disgaea', 'Episode 12', '', 'Future Card Buddyfight', 'Episode 64', '', 'Future Card Buddyfight Ace', 'Episode 43', '', 'Future Card Buddyfight Hundred', 'Episode 25', '', 'Future Card Buddyfight Triple D', 'Episode 51', '', 'Future Card Buddyfight X', 'Episode 60', '', 'Inazuma Eleven', 'Episode 127', '', 'Inazuma Eleven Go', 'Episode 47', '', 'Inazuma Eleven Go: Chrono Stone', 'Episode 51', '', 'Inazuma Eleven: Balance of Ares', 'Episode 23', '', 'Inazuma Eleven Go: Galaxy', 'Episode 43', '', 'Major 2nd (TV)', 'Episode 50', '', 'Mix', 'Episode 24', '', 'Oreca Battle', 'Episode 51', '2', '3', '›', '»']"
https://4anime.gg/studio/dongwoo-ae,3,Watch Dongwoo A&E anime online for Free on 9anime,Here on 9anime you can find all the latest and famous anime from Dongwoo A&E in HD Quality 1080. Watch and Download now,"Dongwoo A&E anime, Dongwoo A&E info, Dongwoo A&E download, Dongwoo A&E watch, 9anime, free anime online, watch anime",33,0,93,[],['Dongwoo A&E Studio Anime'],0,9,"['Login', 'Register', 'Browser', 'Genre', 'Random', 'FAQ', 'Option', '', 'Browse', 'Random', 'Genre', '', '', 'Idol Time PriPara', 'Episode 51', '', 'Kiratto Pri☆chan', 'Episode 51', '', 'PriPara', 'Episode 140', '', 'Pretty Rhythm: Dear My Future', 'Episode 51', '', 'Pretty Rhythm: Rainbow Live', 'Episode 51', '', 'Pretty Rhythm: All Star Selection', 'Episode 11', '', 'Himitsu no AiPri', 'Episode 30']"
https://4anime.gg/kamierabi-godapp-season-2-19364,2,Watch KamiErabi GOD.app Season 2 online free on 4anime,Watch KamiErabi GOD.app Season 2 in HD quality and download KamiErabi GOD.app Season 2 HD version for free - DUB and SUB available,"watch KamiErabi GOD.app Season 2 online free, KamiErabi GOD.app Season 2 download, free KamiErabi GOD.app Season 2 stream, KamiErabi GOD.app Season 2 DUB, KamiErabi GOD.app Season 2 SUB",19,0,92,"['KamiErabi GOD.app Season 2', 'KamiErabi GOD.app Season 2']",['Unend'],0,3,"['Login', 'Register', 'Browser', 'Genre', 'Random', 'FAQ', 'Option', '', 'Browse', 'Random', 'Genre', '', 'Action', 'Thriller', 'Unend', 'TV Series', 'Unend', 'Action', 'Thriller']"
https://4anime.gg/genre/action,3,Watch Action Anime Online Free,Free Action Anime Streaming with both Subbed and Dubbed. Download Action anime online FREE from Zoro.to website.,"watch Action anime, free Action anime, download Action anime, latest Action anime, dubbed Action anime, subbed Action anime, most watched Action anime",121,0,342,[],['Genre Action'],0,37,"['Login', 'Register', 'Browser', 'Genre', 'Random', 'FAQ', 'Option', '', 'Browse', 'Random', 'Genre', '', '', 'Jungle no Ouja Taa-chan', 'Episode 1', '', 'Majestic Prince Episode 25 – Wings to the Future', 'Episode 1', '', 'Spooky Kitaro: Giant Sea Monster', 'Episode 1', '', 'My Hero Academia Season 2: Hero Notebook', 'Episode 1', '', 'Ghost in the Shell: Stand Alone Complex 2nd GIG - Individual Eleven', 'Episode 1', '', 'Ghost in the Shell: Stand Alone Complex - The Laughing Man', 'Episode 1', '', 'Koukaku Kidoutai Arise: Another Mission', 'Episode 1', '', 'Mob Psycho 100: Dai Ikkai Rei toka Soudansho Ian Ryokou - Kokoro Mitasu Iyashi no Tabi', 'Episode 1', '', 'Mob Psycho 100: Reigen - Shirarezaru Kiseki no Reinouryokusha', 'Episode 1', '', 'High School DxD BorN: Yomigaeranai Fushichou', 'Episode 1', '', 'High School DxD Hero: Taiikukan-ura no Holy', 'Episode 1', '', 'Full Metal Panic! Invisible Victory Intermission', 'Episode 2', '', 'Gundam Build Divers Prologue', 'Episode 1', '', 'Kyousou Giga', 'Episode 1', '', 'Nanbaka: Idiots with Student Numbers!', 'Episode 1', '', 'Mirai Nikki OVA', 'Episode 1', '', 'The Future Diary: Redial', 'Episode 1', '', 'Fate/Grand Order -First Order-', 'Episode 1', '', 'Fate/Grand Order: Moonlight/Lostroom', 'Episode 1', '', 'Fist of the North Star: The Legend of Toki', 'Episode 1', '', 'Hokuto no Ken: Yuria-den', 'Episode 1', '', 'New Fist of the North Star', 'Episode 3', '', 'Hokuto no Ken: Raoh Gaiden Gekitou-hen', 'Episode 1', '', 'Fist of the North Star: Raoh Side Story Junai Arc', 'Episode 1', '', 'Garo: Crimson Moon - The Butterfly of Time', 'Episode 1', '', 'Mokei Senshi Gunpla Builders Beginning G', 'Episode 1', '', 'Mobile Suit Gundam AGE: Memory of Eden', 'Episode 2', '', 'Mobile Suit Gundam Wing: Operation Meteor', 'Episode 4', '', 'Chou Deneiban SD Gundam Sangokuden Brave Battle Warriors', 'Episode 1', '', 'Mobile Suit Gundam SEED Special Edition', 'Episode 3', '', 'Mobile Suit Gundam SEED Destiny Special Edition', 'Episode 4', '', 'Appleseed', 'Episode 1', '', 'Izetta: The Last Witch', 'Episode 12', '', 'Laughing Under the Clouds', 'Episode 12', '', 'Bobobo-bo Bo-bobo Recap', 'Episode 1', '2', '3', '›', '»']"
https://4anime.gg/genre/thriller,3,Watch Thriller Anime Online Free,Free Thriller Anime Streaming with both Subbed and Dubbed. Download Thriller anime online FREE from Zoro.to website.,"watch Thriller anime, free Thriller anime, download Thriller anime, latest Thriller anime, dubbed Thriller anime, subbed Thriller anime, most watched Thriller anime",121,0,258,[],['Genre Thriller'],0,37,"['Login', 'Register', 'Browser', 'Genre', 'Random', 'FAQ', 'Option', '', 'Browse', 'Random', 'Genre', '', '', 'Steins;Gate: Egoistic Poriomania', 'Episode 1', '', 'The Promised Neverland Season 2 Episode 5.5', 'Episode 1', '', 'B: The Beginning 2', 'Episode 6', '', 'Magia Record: Puella Magi Madoka Magica Side Story', 'Episode 13', '', 'Box of Goblins: The Case of the Spirits in the Boxes', 'Episode 1', '', 'Shiki Specials', 'Episode 2', '', 'Touhai Densetsu Akagi: Yami ni Maiorita Tensai', 'Episode 26', '', 'Angels of Death', 'Episode 16', '', 'Another', 'Episode 12', '', 'AD Police Files', 'Episode 3', '', 'Adventure of Gamba', 'Episode 26', '', 'Imawa no Kuni no Alice (OVA)', 'Episode 3', '', 'B: The Beginning', 'Episode 12', '', 'Blue Literature', 'Episode 12', '', 'Box of Goblins', 'Episode 13', '', ""Beautiful Bones -Sakurako's Investigation-"", 'Episode 12', '', '[C] CONTROL - The Money and Soul of Possibility', 'Episode 11', '', 'Death Note', 'Episode 37', '', 'Death Parade', 'Episode 12', '', 'Eden of The East', 'Episode 11', '', 'The Future Diary', 'Episode 26', '', 'Fantastic Children', 'Episode 26', '', 'Gankutsuou: The Count of Monte Cristo', 'Episode 24', '', 'Ga-Rei-Zero', 'Episode 12', '', 'When They Cry', 'Episode 26', '', 'When They Cry: Kai', 'Episode 24', '', 'Higurashi: When They Cry – Gou', 'Episode 24', '', 'Kagewani', 'Episode 13', '', 'Kagewani -II-', 'Episode 13', '', 'Kaiji: Against All Rules', 'Episode 26', '', 'Monster', 'Episode 74', '', 'Moriarty the Patriot', 'Episode 11', '', 'Magical Girl Raising Project', 'Episode 12', '', 'Paranoia Agent', 'Episode 13', '', 'Puella Magi Madoka Magica', 'Episode 12', '2', '3', '›', '»']"
https://4anime.gg/studio/unend,3,Watch Unend anime online for Free on 9anime,Here on 9anime you can find all the latest and famous anime from Unend in HD Quality 1080. Watch and Download now,"Unend anime, Unend info, Unend download, Unend watch, 9anime, free anime online, watch anime",18,0,64,[],['Unend Studio Anime'],0,4,"['Login', 'Register', 'Browser', 'Genre', 'Random', 'FAQ', 'Option', '', 'Browse', 'Random', 'Genre', '', '', 'KamiErabi GOD.app', 'Episode 12', '', 'KamiErabi GOD.app Season 2', 'Episode 5']"
https://4anime.gg/delicos-nursery-19228,2,Watch Delico's Nursery online free on 4anime,Watch Delico's Nursery in HD quality and download Delico's Nursery HD version for free - DUB and SUB available,"watch Delico's Nursery online free, Delico's Nursery download, free Delico's Nursery stream, Delico's Nursery DUB, Delico's Nursery SUB",23,0,242,"[""Delico's Nursery"", ""Delico's Nursery""]",['J.C.Staff'],0,3,"['Login', 'Register', 'Browser', 'Genre', 'Random', 'FAQ', 'Option', '', 'Browse', 'Random', 'Genre', '', 'Mystery', 'Fantasy', 'Vampire', 'Supernatural', 'J.C.Staff', 'TV Series', 'J.C.Staff', 'Mystery', 'Fantasy', 'Vampire', 'Supernatural']"
